query,original_url,archive_url,title,snippet,archive_date,year
abandono rural,http://aveirolx.blogspot.com/2005/09/campanha-vista-de-lisboa-iii-gesto.html?showComment=1127393640000,https://arquivo.pt/wayback/20110703223129/http://aveirolx.blogspot.com/2005/09/campanha-vista-de-lisboa-iii-gesto.html?showComment=1127393640000,Notas de Aveiro: Campanha vista de Lisboa III - Gestão comunicacional," dinheiros; as obras no centro da cidade e correspondente <em>abandono</em> das freguesias rurais; a pouca<span class=""ellipsis""> ... </span> empatar tecnicamente em aveiro e ganhar na parte <em>rural</em> aveirense !!! tinhamos um presidente do povo <em>rural</em>!!!:)) 22 de Setembro de 2005 13h54min00s WEST AAS disse... Pois &eacute; Jo&atilde;o... e quem ganha com isto &eacute;<span class=""ellipsis""> ... </span>",1309732289,2011
abandono rural,http://arvoresaopoder.blogspot.com/,https://arquivo.pt/wayback/20110520112524/http://arvoresaopoder.blogspot.com/,Árvores ao Poder," ouviu. Mas ouviu-se falar de turismo <em>rural</em> em casas de fun&ccedil;&atilde;o, que deveriam ser de fun&ccedil;&atilde;o, e na<span class=""ellipsis""> ... </span> esqueceram de falar no <em>abandono</em> a que foi votado durante quase 4 anos, at&eacute; &agrave; degrada&ccedil;&atilde;o total e do<span class=""ellipsis""> ... </span> seja um equipamento tamb&eacute;m deliberadamente votado ao <em>abandono</em> pela CML nos &uacute;ltimos tempos. Salvou-se o<span class=""ellipsis""> ... </span>",1305890724,2011
abandono rural,http://www.pharmacypractice.org/vol05/pdf/051-058-en.pdf,https://arquivo.pt/wayback/20110110185112/http://www.pharmacypractice.org/vol05/pdf/051-058-en.pdf,Varenicline: A review of the literature and place in therapy.," and <em>Rural</em> 
Medicine, University of Alabama School of Medicine, 
Tuscaloosa,AL (USA). 
Krystal L<span class=""ellipsis""> ... </span>), ofrece un 
mecanismo de acci&oacute;n novedoso para el <em>abandono</em> 
del tabaco. Este art&iacute;culo revisa las<span class=""ellipsis""> ... </span> los pacientes consejo 
comportamental en cada tentativa de <em>abandono</em> y 
durante un a&ntilde;o despu&eacute;s de la<span class=""ellipsis""> ... </span>",1294685472,2011
abandono rural,http://arnulfo.files.wordpress.com/2011/11/kingvrp.pdf,https://arquivo.pt/wayback/20111202213603/http://arnulfo.files.wordpress.com/2011/11/kingvrp.pdf,Arq._Vernacula_Nor..doc," superfluos e influencias 
estil&iacute;sticas, sin el <em>abandono</em> de la est&eacute;tica, la construcci&oacute;n de espacios &uacute;tiles y<span class=""ellipsis""> ... </span> <em>rural</em> , en Jornadas sobre la Identidad de la Cultura Norestense; p. 85 .  
 5
 
 
El regionalismo del<span class=""ellipsis""> ... </span> <em>rural</em> .  
Haciendas : ganader as, mineras, y  de agricultura.  
De gobierno : casas reales<span class=""ellipsis""> ... </span>",1322861763,2011
abandono rural,http://cm-figueirodosvinhos.pt/_assets/content/educacaojuventude/carta/Carta_Educativa_do_Municipio_de_Figueiro_dos_Vinhos.pdf,https://arquivo.pt/wayback/20110120232659/http://cm-figueirodosvinhos.pt/_assets/content/educacaojuventude/carta/Carta_Educativa_do_Municipio_de_Figueiro_dos_Vinhos.pdf,A caracterização climática do concelho de Amares será realizada com base nos valores das Normais Cli," de 15 a 19, 20 a 24 e 25 a 29 anos... 65 
4.1.3 <em>Abandono</em>, sa&iacute;da antecipada e sa&iacute;da precoce<span class=""ellipsis""> ... </span>................................................................................... 153 
7.1.5 Combate ao <em>abandono</em> e<span class=""ellipsis""> ... </span>) ........................................................................................................................................66 
Gr&aacute;fico 4.1.3a &#8211; Taxa de <em>abandono</em>, sa&iacute;da<span class=""ellipsis""> ... </span>",1295566019,2011
abandono rural,http://noticiasdaaldeia.blogspot.com/2007_10_01_archive.html,https://arquivo.pt/wayback/20110121021541/http://noticiasdaaldeia.blogspot.com/2007_10_01_archive.html,Notícias d´Aldeia: Outubro 2007," tempos de <em>abandono</em>, dias sem uma refei&ccedil;&atilde;o quente ou uma palavra amiga. Aqueles que procuram o<span class=""ellipsis""> ... </span> via do desaparecimento nestas &aacute;guas dos pequenos peixes de que se alimentam, e do <em>abandono</em> agr&iacute;cola<span class=""ellipsis""> ... </span> progressivo envenenamento das &aacute;guas, o <em>abandono</em> dos bra&ccedil;os da ria, e a falta de uma entidade gestora<span class=""ellipsis""> ... </span>",1295576141,2011
abandono rural,http://alinhaetua.blogspot.com/2009_10_01_archive.html,https://arquivo.pt/wayback/20110120190822/http://alinhaetua.blogspot.com/2009_10_01_archive.html,A Linha é Tua: Outubro 2009," <em>abandono</em> da linha do Tua em document&aacute;rio com estreia no Doclisboa 2009 10 17 - SIC -&nbsp; DocLisboa exibe filme em defesa da Linha do Tua (v&iacute;deo) 2009 10 17 - Destak - Jorge Pelicano alerta para <em>abandono</em><span class=""ellipsis""> ... </span> autocarros subimos ao Pombal . O lanche estava preparado no Hotel <em>Rural</em> Flor do Monte . A ementa era<span class=""ellipsis""> ... </span>",1295550502,2011
abandono rural,http://auren.blogs.sapo.pt/291983.html,https://arquivo.pt/wayback/20110602084037/http://auren.blogs.sapo.pt/291983.html,REALIZA-SE HOJE NO ESTÁDIO DO RESTELO A FESTA DA BEATIFICAÇÃO DA RELIGIOSA MARIA CLARA DO MENINO JES," traz &agrave; mente a for&ccedil;a de Deus que moveu a Irm&atilde; Maria Clara a tirar do estado de <em>abandono</em> em que se<span class=""ellipsis""> ... </span> Caminhos do Ribatejo - Activ. Turismo Espa&ccedil;o <em>Rural</em> Portal do Empreendedor do M&eacute;dio Tejo ADIRN NERSANT<span class=""ellipsis""> ... </span>",1307004037,2011
abandono rural,"http://www.estadao.com.br/noticias/suplementos,as-sombras-de-marisol,739888,0.htm","https://arquivo.pt/wayback/20110706183733/http://www.estadao.com.br/noticias/suplementos,as-sombras-de-marisol,739888,0.htm",As sombras de Marisol - suplementos - Estadao.com.br," vila <em>rural</em> no Estado de Chihuahua, a mais violenta do M&eacute;xico, s&oacute; n&atilde;o cai na insignific&acirc;ncia por<span class=""ellipsis""> ... </span> compreensivo e deu sua b&ecirc;n&ccedil;&atilde;o. Mas uma semana depois ela seria oficialmente demitida por <em>abandono</em> de<span class=""ellipsis""> ... </span>",1309977453,2011
abandono rural,http://divasecontrabaixos.blogspot.com/2007/09/as-cidades-invisveis.html,https://arquivo.pt/wayback/20110122171634/http://divasecontrabaixos.blogspot.com/2007/09/as-cidades-invisveis.html,DIVAS & CONTRABAIXOS: As cidades invisíveis," s&eacute;culos ou a d&eacute;cadas de <em>abandono</em>. Terras que s&atilde;o de quem l&aacute; ficou ou de quem foi para longe, para<span class=""ellipsis""> ... </span> &uacute;ltima candeia e se transformaram em coisa h&iacute;brida, fruto da fus&atilde;o da cultura <em>rural</em> original com os<span class=""ellipsis""> ... </span>",1295716594,2011
abandono rural,http://www.ps.parlamento.pt/deputados/jose-joao-pinhancos-de-bianchi/,https://arquivo.pt/wayback/20110519201417/http://www.ps.parlamento.pt/deputados/jose-joao-pinhancos-de-bianchi/,José João Pinhanços de Bianchi - Grupo Parlamentar do Partido Socialista,"). &iquest;Determinantes escolares, organizativas e curriculares dos <em>Abandono</em> e Insucesso Escolar&iquest;. Actas da 7&ordf; Edi&ccedil;&atilde;o dos<span class=""ellipsis""> ... </span> <em>Rural</em> e Pescas [Suplente] Comiss&atilde;o de Educa&ccedil;&atilde;o e Ci&ecirc;ncia [Suplente] P&aacute;gina no site da Assembleia<span class=""ellipsis""> ... </span>",1305836057,2011
abandono rural,http://www.conteudos.easysite.com.pt/files/68/ficheiros/boletins_v2/ASSP_BI_164_MarAbr10.pdf,https://arquivo.pt/wayback/20110704115917/http://www.conteudos.easysite.com.pt/files/68/ficheiros/boletins_v2/ASSP_BI_164_MarAbr10.pdf,Boletim 152," querer cair numa nostalgia f&aacute;cil, h&aacute; que reconhecer que o progressivo <em>abandono</em> dos h&aacute;bitos tradicionais do
meio <em>rural</em>, assim como o aparecimento de novas t&eacute;cnicas construtivas e a enorme press&atilde;o do<span class=""ellipsis""> ... </span>",1309780757,2011
abandono rural,http://jornalalpiarcense.blogspot.com/2009/03/alpiarca-terra-de-encanto-mas-tao-mal.html,https://arquivo.pt/wayback/20110524134655/http://jornalalpiarcense.blogspot.com/2009/03/alpiarca-terra-de-encanto-mas-tao-mal.html,JORNAL ALPIARCENSE - UMA REFERÊNCIA NA INFORMAÇÃO ALPIARCENSE: Alpiarça “Terra de Encanto” mas tão m," Patudos&#8221; come&ccedil;a a parecer que est&aacute; ao <em>abandono</em> ou que &eacute; &laquo;um espa&ccedil;o de ningu&eacute;m&raquo; tal &eacute; o desmazelo que<span class=""ellipsis""> ... </span> falta de manuten&ccedil;&atilde;o como do <em>abandono</em> que se pode ver, em nada dignifica quem &eacute; respons&aacute;vel pela sua<span class=""ellipsis""> ... </span> RUSSOS Emparcelamento <em>Rural</em> Afinal, Rosa do C&eacute;u ser&aacute; t&atilde;o incompetente como diz... Rosa do C&eacute;u, n&atilde;o<span class=""ellipsis""> ... </span>",1306244815,2011
abandono rural,http://umaideiadesantiago.blogspot.com/,https://arquivo.pt/wayback/20110526071018/http://umaideiadesantiago.blogspot.com/,Ideias para Santiago do Cacém," descentraliza&ccedil;&atilde;o dos servi&ccedil;os municipais. Correc&ccedil;&atilde;o dos erros graves tais como o <em>abandono</em> a que a sede de<span class=""ellipsis""> ... </span> dinamiza&ccedil;&atilde;o da parte <em>rural</em> da freguesia de Santo Andr&eacute; e da freguesia de Santa Cruz, a aus&ecirc;ncia de<span class=""ellipsis""> ... </span>",1306393818,2011
abandono rural,"http://www.manuelalegre.com/302000/1/000330,000001/index.htm","https://arquivo.pt/wayback/20110121225137/http://www.manuelalegre.com/302000/1/000330,000001/index.htm","Manuel Alegre : ""É preciso repensar os critérios monetaristas que estão a contaminar a Europa"""," do <em>abandono</em>. Algumas cidades do interior t&ecirc;m ultimamente mostrado um certo dinamismo demogr&aacute;fico e<span class=""ellipsis""> ... </span> potencialidades do mundo <em>rural</em>. E precisa de uma verdadeira institui&ccedil;&atilde;o regional onde os autarcas do interior<span class=""ellipsis""> ... </span>",1295650297,2011
abandono rural,http://eduardus.blogs.sapo.pt/,https://arquivo.pt/wayback/20110121043516/http://eduardus.blogs.sapo.pt/,"FIÉIS, COMPETENTES E COMBATIVOS!"," absoluto pelo insucesso&nbsp;e <em>abandono</em> escolar dos seus alunos, o docente de agora v&ecirc;-se assim de repente<span class=""ellipsis""> ... </span> estat&iacute;stica que &eacute; preciso baixar no insucesso, no <em>abandono</em>,&nbsp;nos ratios ...&nbsp; e h&aacute; que empregar todos<span class=""ellipsis""> ... </span> negativa nos alunos que ainda n&atilde;o est&atilde;o inseridos em Centros Escolares, v&iacute;timas de &quot;<em>abandono</em>&quot; e &quot;exclus&atilde;o<span class=""ellipsis""> ... </span>",1295584516,2011
abandono rural,http://eb23s-vilarformoso.edu.pt/documentos/Plano%20Anual%20de%20Actividades%20do%20AEVF%202009-2010.pdf,https://arquivo.pt/wayback/20110127100910/http://eb23s-vilarformoso.edu.pt/documentos/Plano%20Anual%20de%20Actividades%20do%20AEVF%202009-2010.pdf,Microsoft Word - Plano Anual de Actividades do AEVF 2009-2010," | 8
Nave de Haver &eacute; uma aldeia situada no meio <em>rural</em>, a 30 km de Almeida, sede do concelho, e 15km<span class=""ellipsis""> ... </span> Plano
Centen&aacute;rio <em>Rural</em>, integrada numa &aacute;rea habitacional, est&aacute; edificada numa zona verde e silenciosa<span class=""ellipsis""> ... </span> absentismo e risco de <em>abandono</em> escolar.
Metas do PE:
&#61623;Proporcionar a todos os alunos o acesso &agrave; pr&aacute;tica de<span class=""ellipsis""> ... </span>",1296122950,2011
abandono rural,http://planeta-sol.blogs.sapo.pt/,https://arquivo.pt/wayback/20110518025002/http://planeta-sol.blogs.sapo.pt/,Planeta-Sol,", por este meu mau comportamento, quase que um <em>abandono</em>, mas creiam, n&atilde;o &eacute; <em>abandono</em>, &eacute; mesmo falta<span class=""ellipsis""> ... </span> <em>rural</em> perdida no interior de um pequeno pa&iacute;s na orla ocidental da Europa. A Casa do Penedo come&ccedil;ou a ser<span class=""ellipsis""> ... </span>, religiosa, <em>rural</em> e urbana, influenciam sobre maneira, as nossas tend&ecirc;ncias, na escolha de raz&otilde;es, para<span class=""ellipsis""> ... </span>",1305687002,2011
abandono rural,http://umportodostodosporum.blogspot.com/2007/07/blog-post.html,https://arquivo.pt/wayback/20110522162557/http://umportodostodosporum.blogspot.com/2007/07/blog-post.html,"um por todos, todos por um: Reunião à porta fechada de Altos Funcionários de um Organismo menor da A","... Em www.google.pt escrevemos <em>Abandono</em> do miolo urba... Em www.google.pt escrevemos Pior desordenamento<span class=""ellipsis""> ... </span>.google.pt escrevemos Passagem de Solo <em>Rural</em>... Em www.google.pt escrevemos PCP acorrentado, demos<span class=""ellipsis""> ... </span> hectares de solo <em>rural</em>, com REN... &#8220;Na V&aacute;rzea da Moita as pessoas v&atilde;o continuar, porq... Ser&aacute; isto o<span class=""ellipsis""> ... </span>",1306081557,2011
abandono rural,http://sweet.ua.pt/~amm/cientifica/doc8/doc8.pdf,https://arquivo.pt/wayback/20110708133026/http://sweet.ua.pt/~amm/cientifica/doc8/doc8.pdf,A legitimação psicológica do insucesso escolar e a (des)responsabilização dos professores," conseguinte, dum concelho: interior; <em>rural</em> (em 1991 56.6% da popula&ccedil;&atilde;o activa 
no sector prim&aacute;rio); com<span class=""ellipsis""> ... </span>, repet&ecirc;ncia e 
de <em>abandono</em> escolar. Existe, contudo, um outro tipo de insucesso escolar n&atilde;o<span class=""ellipsis""> ... </span>)sucesso o problema est&aacute; longe de ser resolvido e as taxas de reprova&ccedil;&atilde;o 
e de <em>abandono</em> escolar mant&ecirc;m<span class=""ellipsis""> ... </span>",1310131826,2011
abandono rural,http://magisterio6971.blogs.sapo.pt/2010/01/?page=2,https://arquivo.pt/wayback/20110307160123/http://magisterio6971.blogs.sapo.pt/2010/01/?page=2,Janeiro 2010 - Magistério6971," portuguesa. No <em>abandono</em> a que o Porto tem sido votado est&aacute; a causa de muitos dos males que duramente<span class=""ellipsis""> ... </span> ra&iacute;zes e em todo o meio <em>rural</em>. Na minha meninice ia-se &agrave; fonte onde a &aacute;gua brotava l&iacute;mpida. Na fonte<span class=""ellipsis""> ... </span>",1299513683,2011
abandono rural,http://arvoresaopoder.blogspot.com/,https://arquivo.pt/wayback/20110630165757/http://arvoresaopoder.blogspot.com/,Árvores ao Poder," vis&iacute;veis, &eacute; extremamente deficiente chegando-se ao c&uacute;mulo de deixar equipamentos ao <em>abandono</em> e &agrave;<span class=""ellipsis""> ... </span>-se falar de turismo <em>rural</em> em casas de fun&ccedil;&atilde;o, que deveriam ser de fun&ccedil;&atilde;o, e na casa do senhor<span class=""ellipsis""> ... </span> no <em>abandono</em> a que foi votado durante quase 4 anos, at&eacute; &agrave; degrada&ccedil;&atilde;o total e do parque da pedra, j&aacute; em<span class=""ellipsis""> ... </span>",1309453077,2011
abandono rural,http://cdp.portodigital.pt/Members/admin/modalidades_ensino/DC_453_2004.pdf,https://arquivo.pt/wayback/20110519232510/http://cdp.portodigital.pt/Members/admin/modalidades_ensino/DC_453_2004.pdf,,".
MINIST&Eacute;RIO DA AGRICULTURA,
DESENVOLVIMENTO <em>RURAL</em> E PESCAS
Direc&ccedil;&atilde;o Regional de Agricultura do<span class=""ellipsis""> ... </span> Desenvolvimento <em>Rural</em>, no uso
de compet&ecirc;ncias delegadas, de 4 de Dezembro de 2003:
Lu&iacute;sa de Jesus<span class=""ellipsis""> ... </span> como a preven&ccedil;&atilde;o dos diferentes tipos de
<em>abandono</em> escolar, designadamente o desqualificado. Estas<span class=""ellipsis""> ... </span>",1305847510,2011
abandono rural,http://amizade7b.blogs.sapo.pt/,https://arquivo.pt/wayback/20110120190244/http://amizade7b.blogs.sapo.pt/,8ºB Nevogilde," Sousa, o concelho de Lousada abrange 25 freguesias. O concelho de Lousada &eacute; essencialmente <em>rural</em><span class=""ellipsis""> ... </span> est&aacute; um pouco ao <em>abandono</em>, Simone de Oliveira, por exemplo,&#8221;&#8230; n&atilde;o deixou de apontar as &#8216;car&ecirc;ncias do<span class=""ellipsis""> ... </span>",1295550164,2011
abandono rural,http://aeiou.visao.pt/cavaco-silva-portugal-nao-pode-falhar=f607330,https://arquivo.pt/wayback/20110611153411/http://aeiou.visao.pt/cavaco-silva-portugal-nao-pode-falhar=f607330,Cavaco Silva Portugal não pode falhar - Visao.pt,"Cavaco Silva Portugal n&atilde;o pode falhar - Visao.pt Em destaque &#9660; Top 10: Os maiores hackers de sempre<span class=""ellipsis""> ... </span>",1307806451,2011
abandono rural,http://mobilizacaoeunidadedosprofessores.blogspot.com/2010/06/tomadas-de-posicao-do-agrupamento-de.html,https://arquivo.pt/wayback/20110523132538/http://mobilizacaoeunidadedosprofessores.blogspot.com/2010/06/tomadas-de-posicao-do-agrupamento-de.html,MUP - Movimento Mobilização e Unidade dos Professores: TOMADAS DE POSIÇÃO DO AGRUPAMENTO DE ESCOLAS ," geral; - a Freguesia de Semide &eacute; a maior freguesia <em>rural</em> no Concelho, sendo a &uacute;nica com as suas<span class=""ellipsis""> ... </span>%; - que o <em>abandono</em> escolar &eacute; residual, n&atilde;o tendo praticamente express&atilde;o; - a inexist&ecirc;ncia de<span class=""ellipsis""> ... </span> Educativo &uacute;nico; - a Freguesia de Semide &eacute; a maior freguesia <em>rural</em> no Concelho, sendo a &uacute;nica com as suas<span class=""ellipsis""> ... </span>",1306157138,2011
abandono rural,http://mardoce.dyndns.org/planosordenamento/Sabugal/RNT_Sabugal.pdf,https://arquivo.pt/wayback/20110124093527/http://mardoce.dyndns.org/planosordenamento/Sabugal/RNT_Sabugal.pdf,Microsoft Word - RNT_8063DPNT00NT0.doc," <em>abandono</em> de terras. No seguimento da estrat&eacute;gia definida, 
pensa-se que algumas destas ru&iacute;nas e<span class=""ellipsis""> ... </span> tur&iacute;stico. O plano 
prev&ecirc; igualmente a possibilidade de constru&ccedil;&atilde;o de um Hotel <em>Rural</em>. 
 
Pensa-se<span class=""ellipsis""> ... </span> possibilidade de utilizar e transformar essas constru&ccedil;&otilde;es noutro tipo de 
oferta &#8211; Turismo em Espa&ccedil;o <em>Rural</em><span class=""ellipsis""> ... </span>",1295861727,2011
abandono rural,http://a-ciencia-nao-e-neutra.blogspot.com/2011/04/o-mix-energetico-europeu-e-portugal.html,https://arquivo.pt/wayback/20110630175427/http://a-ciencia-nao-e-neutra.blogspot.com/2011/04/o-mix-energetico-europeu-e-portugal.html,A ciência não é neutra: O mix eléctrico europeu: I - Sul e Centro," avers&atilde;o &agrave; tecnologia industrial de um povo sa&iacute;do quase directamente do mundo <em>rural</em> para o<span class=""ellipsis""> ... </span> nos oferecemos no rescaldo do <em>abandono</em> das seculares posi&ccedil;&otilde;es ultramarinas, de modo a mostrar a<span class=""ellipsis""> ... </span> a energia nuclear &eacute; a aposta da Rom&eacute;nia para o seu <em>abandono</em> a prazo do carv&atilde;o e a descarboniza&ccedil;&atilde;o. &Eacute;<span class=""ellipsis""> ... </span>",1309456467,2011
abandono rural,http://economiadepalavras.blogspot.com/2005_12_01_archive.html,https://arquivo.pt/wayback/20110120192108/http://economiadepalavras.blogspot.com/2005_12_01_archive.html,Economia de Palavras," desfecho de um mau romance. Em mat&eacute;ria de cemit&eacute;rios, prefiro os que est&atilde;o em ru&iacute;nas e ao <em>abandono</em><span class=""ellipsis""> ... </span> essenciais da exist&ecirc;ncia(&#8230;) Digamos que o velho Portugal <em>rural</em> e pr&eacute;-industrial fechado sobre si e sobre o<span class=""ellipsis""> ... </span>",1295551268,2011
abandono rural,http://vozdodeserto.blogspot.com/2006_10_01_archive.html,https://arquivo.pt/wayback/20110121105803/http://vozdodeserto.blogspot.com/2006_10_01_archive.html,Voz do Deserto: 10/01/2006 - 11/01/2006," N&atilde;o mas n&atilde;o farei campanha. <em>Abandono</em> guerras que alistam mulheres em saliva&ccedil;&atilde;o apolog&eacute;tica (com<span class=""ellipsis""> ... </span> deix&aacute;-las entregue &agrave; desertifica&ccedil;&atilde;o <em>rural</em>. Ter&ccedil;a-feira, Outubro 10, 2006 Queda &quot; But perhaps you think<span class=""ellipsis""> ... </span>",1295607483,2011
abandono rural,http://ardotempo.blogs.sapo.pt/323523.html,https://arquivo.pt/wayback/20110219170720/http://ardotempo.blogs.sapo.pt/323523.html,"""Nojo...até quando mamãe vai agir assim?"" - ARdoTEmpo"," correr por dentro, uma solid&atilde;o de <em>abandono</em> a invadi-la, apesar do calor do dia e do sol escaldante. Saiu<span class=""ellipsis""> ... </span>-se da praia, desse jeito logo estariam na parte <em>rural</em> da cidadezinha. Os que os viram passar ao longe<span class=""ellipsis""> ... </span>",1298135240,2011
abandono rural,http://home.utad.pt/~tcaria/tcaria/textos/CV_Janeiro2008.pdf,https://arquivo.pt/wayback/20110121111036/http://home.utad.pt/~tcaria/tcaria/textos/CV_Janeiro2008.pdf,Microsoft Word - CV_em curso.rtf," para a p&oacute;s-obrigat&oacute;ria em 
contexto <em>rural</em>. Vila Real: Universidade de Tr&aacute;s-Os-Montes e Alto Douro<span class=""ellipsis""> ... </span>- Atribui&ccedil;&atilde;o causal e representa&ccedil;&otilde;es sociais sobre o (in)sucesso e 
<em>abandono</em> escolar. Vila Real<span class=""ellipsis""> ... </span> 
Jo&atilde;o Sebasti&atilde;o,1994: Renunciar &agrave; escola - o <em>abandono</em> escolar no ensino b&aacute;sico,  
Lisboa, Fim de s&eacute;culo<span class=""ellipsis""> ... </span>",1295608236,2011
abandono rural,http://jangada-de-pedra.blogspot.com/2009_10_01_archive.html,https://arquivo.pt/wayback/20110520121008/http://jangada-de-pedra.blogspot.com/2009_10_01_archive.html,Jangada de Pedra: Outubro 2009," traduzir num <em>abandono</em> da luta, na prioridade dada &agrave; melhoria das condi&ccedil;&otilde;es individuais. Alguns seguir&atilde;o<span class=""ellipsis""> ... </span> que evolui para um pessimismo que empurra para o <em>abandono</em>, a ruptura do compromisso. Voltando a<span class=""ellipsis""> ... </span> este Min.) Ministro da Agricultura, do Desenvolvimento <em>Rural</em> e das Pescas - Ant&oacute;nio Manuel Soares<span class=""ellipsis""> ... </span>",1305893408,2011
abandono rural,http://agenda.universia.pt/outras/2010/06/30/176-a-166-belonging,https://arquivo.pt/wayback/20110120200655/http://agenda.universia.pt/outras/2010/06/30/176-a-166-belonging,17/6 a 16/6 - Belonging » outras » Portugal » Agenda Universia,". Provocador e irreverente, &#8220;Belonging&#8221; aborda temas intemporais como a perda, o <em>abandono</em>, o rapto, os medos<span class=""ellipsis""> ... </span> <em>rural</em> de Portugal. Duas companhias, cada uma com o seu pr&oacute;prio estilo, mas com algo em comum: o<span class=""ellipsis""> ... </span>",1295554015,2011
abandono rural,http://www.cm-odivelas.pt/Noticias/index.asp,https://arquivo.pt/wayback/20110519175215/http://www.cm-odivelas.pt/Noticias/index.asp,Notícias," dia 18 de Maio. Ler artigo Exposi&ccedil;&atilde;o sobre o Mundo <em>Rural</em> - 19/5/2011 A Exposi&ccedil;&atilde;o <em>Rural</em>&#146;art foi inaugurada, no dia 18 de Maio, nas instala&ccedil;&otilde;es do Programa do Urbano ao <em>Rural</em>. No mesmo dia, celebrou-se o<span class=""ellipsis""> ... </span> Programa Urbano ao <em>Rural</em> , que mais uma vez proporcionou aos visitantes um dia diferente em contacto com o<span class=""ellipsis""> ... </span>",1305827535,2011
abandono rural,http://lusitanianotavel.canalblog.com/archives/2005/12/25/1149007.html,https://arquivo.pt/wayback/20110124040307/http://lusitanianotavel.canalblog.com/archives/2005/12/25/1149007.html,Portugal Notável," manter o ambiente <em>rural</em> e deixar as marcas do tempo&raquo;. De um templo muito perto do mar. 2005: O IPPAR<span class=""ellipsis""> ... </span> propriedade do Estado, o im&oacute;vel permaneceu quase ao <em>abandono</em> at&eacute; 1996. Umas pequenas opera&ccedil;&otilde;es de cosm&eacute;tica<span class=""ellipsis""> ... </span>",1295841787,2011
abandono rural,http://parm-moncorvo.blogspot.com/2009_07_01_archive.html,https://arquivo.pt/wayback/20110121061831/http://parm-moncorvo.blogspot.com/2009_07_01_archive.html,PARM: Julho 2009," (2) Patrim&oacute;nio (7) Patrim&oacute;nio Geol&oacute;gico e Mineiro (7) Patrim&oacute;nio Natural (5) Patrim&oacute;nio <em>Rural</em> (3<span class=""ellipsis""> ... </span> se levar a carrinha ou o tractor aos pr&eacute;dios (alguns deles hoje ao <em>abandono</em>). Um desses tro&ccedil;os, em<span class=""ellipsis""> ... </span> do s&eacute;c. XIX/in&iacute;cios de XX (hoje ao <em>abandono</em> e em ru&iacute;nas), a f&aacute;brica de cobertores do Felgar (de que<span class=""ellipsis""> ... </span>",1295590711,2011
abandono rural,http://www.linhasdeelvas.net/pagina/edicao/4/17/noticia/7491/9.0.0,https://arquivo.pt/wayback/20110111172025/http://www.linhasdeelvas.net/pagina/edicao/4/17/noticia/7491/9.0.0,PSD quer esclarecimentos sobre campo de golfe de Marvão," do mundo <em>rural</em>. &quot;D&oacute;i um pouco a alma ver a degrada&ccedil;&atilde;o em que est&aacute; esta estrutura&quot;, confessou. O<span class=""ellipsis""> ... </span>, tendo sido considerado em 2000, pela Federa&ccedil;&atilde;o Portuguesa de Golfe, &quot;O Campo do Ano&quot;. Ao <em>abandono</em><span class=""ellipsis""> ... </span>",1294766425,2011
