query,original_url,archive_url,title,snippet,archive_date,year
abandono rural,http://norteemrede.inescporto.pt/financiamentos/programa-de-desenvolvimento-rural/relatorios-de-execucao/Relatorio_de_Execucao_2008.pdf,https://arquivo.pt/wayback/20110124054639/http://norteemrede.inescporto.pt/financiamentos/programa-de-desenvolvimento-rural/relatorios-de-execucao/Relatorio_de_Execucao_2008.pdf,(Microsoft Word - Relat\363rio_2008 em revis\343o SD-formatado rev 2.doc)," desenvolvimento 
<em>rural</em> para 2007-2013 (Decreto-Lei n.&ordm; 2/2008, de 4 de Janeiro), estabeleceu as regras gerais de 
aplica&ccedil;&atilde;o dos programas de desenvolvimento <em>rural</em>, adoptados no &acirc;mbito do PEN (Decreto-Lei n<span class=""ellipsis""> ... </span> produtor a 
descerem 13%. A queda continuada dos pre&ccedil;os da azeitona tem provocado o <em>abandono</em> dos<span class=""ellipsis""> ... </span>",1295847999,2011
abandono rural,http://oalvaiazerense.com.pt/jornais/0712_dez07.pdf,https://arquivo.pt/wayback/20110121111133/http://oalvaiazerense.com.pt/jornais/0712_dez07.pdf,DEZEMBRO_quinta.pmd,", cons-
tatando &quot;o <em>abandono</em> da cultura <em>rural</em> pelo
mundo acad&eacute;mico, mas que agora j&aacute; mu-
dou de atitude<span class=""ellipsis""> ... </span> em redor, adquirida por um valor de 315 mil euros, e cujo
objectivo &eacute; transformar em hotel <em>rural</em><span class=""ellipsis""> ... </span> <em>rural</em>&quot;, constatando que &quot;muita gente
tem demonstrado interesse em construir fora do centro urbano por<span class=""ellipsis""> ... </span>",1295608293,2011
abandono rural,http://www.crtvg.es/TVGacarta/?prog=111,https://arquivo.pt/wayback/20110121163035/http://www.crtvg.es/TVGacarta/?prog=111,Televisión á carta," &uacute;ltimo libro &quot;Para Seguir Bailando&quot; , un conxunto de dez relatos en que aborda temas como o <em>abandono</em> do medio <em>rural</em>, a corrupci&oacute;n, a memoria ou o abuso exercido sobre a muller. Na secci&oacute;n de cr&iacute;tica<span class=""ellipsis""> ... </span>",1295627435,2011
abandono rural,http://jstomar.blogspot.com/2009/01/comunicado.html,https://arquivo.pt/wayback/20110121025244/http://jstomar.blogspot.com/2009/01/comunicado.html,JS Tomar: Comunicado,". Na parte <em>rural</em> da freguesia, o <em>abandono</em> &eacute; ainda maior o que nos leva a questionar se os<span class=""ellipsis""> ... </span> envolventes ao Convento o <em>abandono</em> &eacute; total, como se pode constatar pelo estado lastimoso em que se<span class=""ellipsis""> ... </span> perigos. &Agrave; medida que continuamos a visita pela parte <em>rural</em> da freguesia percebemos que o estado de<span class=""ellipsis""> ... </span>",1295578364,2011
abandono rural,http://jstomar.blogspot.com/2009_01_01_archive.html,https://arquivo.pt/wayback/20110120233222/http://jstomar.blogspot.com/2009_01_01_archive.html,JS Tomar: Janeiro 2009," <em>abandono</em> &eacute; total, como se pode constatar pelo estado lastimoso em que se encontram os caminhos<span class=""ellipsis""> ... </span> a situa&ccedil;&atilde;o se resolva com a maior brevidade a fim de evitar danos maiores. Na parte <em>rural</em> da freguesia, o <em>abandono</em> &eacute; ainda maior o que nos leva a questionar se os respons&aacute;veis desta junta sabem ou se<span class=""ellipsis""> ... </span>",1295566342,2011
abandono rural,http://jumento.blogspot.com/2007/11/porque-no-fazem-filhos.html,https://arquivo.pt/wayback/20110123000210/http://jumento.blogspot.com/2007/11/porque-no-fazem-filhos.html,O JUMENTO: Porque não fazem filhos?," agr&iacute;colas a determinar o <em>abandono</em> de um modelo agr&iacute;cola que sustentava uma organiza&ccedil;&atilde;o social em grande parte do nosso meio <em>rural</em>, conduzindo ao seu <em>abandono</em> com as consequ&ecirc;ncias, desertifica&ccedil;&atilde;o humana e<span class=""ellipsis""> ... </span> organiza&ccedil;&atilde;o social em grande parte do nosso meio <em>rural</em>, conduzindo ao seu <em>abandono</em> com as consequ&ecirc;ncias<span class=""ellipsis""> ... </span>",1295740930,2011
abandono rural,http://jumento.blogspot.com/2007/11/porque-no-fazem-filhos.html,https://arquivo.pt/wayback/20110524073828/http://jumento.blogspot.com/2007/11/porque-no-fazem-filhos.html,O JUMENTO: Porque não fazem filhos?," agr&iacute;colas a determinar o <em>abandono</em> de um modelo agr&iacute;cola que sustentava uma organiza&ccedil;&atilde;o social em grande parte do nosso meio <em>rural</em>, conduzindo ao seu <em>abandono</em> com as consequ&ecirc;ncias, desertifica&ccedil;&atilde;o humana e<span class=""ellipsis""> ... </span> organiza&ccedil;&atilde;o social em grande parte do nosso meio <em>rural</em>, conduzindo ao seu <em>abandono</em> com as consequ&ecirc;ncias<span class=""ellipsis""> ... </span>",1306222708,2011
abandono rural,http://bretemas.blogspot.com/2005/08/ardemos.html,https://arquivo.pt/wayback/20110120191758/http://bretemas.blogspot.com/2005/08/ardemos.html,Brétemas: Ardemos," para o seu reinado dun marco incompar&aacute;bel favorecido polo despoboamento do <em>rural</em>, que provoca o <em>abandono</em> do monte e que xa que logo, transformao nunha aut&eacute;ntica bomba de reloxer&iacute;a preparada para ben<span class=""ellipsis""> ... </span>",1295551078,2011
abandono rural,http://bretemas.blogspot.com/2005/08/ardemos.html,https://arquivo.pt/wayback/20110520130316/http://bretemas.blogspot.com/2005/08/ardemos.html,Brétemas: Ardemos," para o seu reinado dun marco incompar&aacute;bel favorecido polo despoboamento do <em>rural</em>, que provoca o <em>abandono</em> do monte e que xa que logo, transformao nunha aut&eacute;ntica bomba de reloxer&iacute;a preparada para ben<span class=""ellipsis""> ... </span>",1305896596,2011
abandono rural,http://www.verdade.co.mz/nacional/17430-fabrica-encerra-por-falta-de-mao-de-obra?format=pdf,https://arquivo.pt/wayback/20110424081050/http://www.verdade.co.mz/nacional/17430-fabrica-encerra-por-falta-de-mao-de-obra?format=pdf,Fábrica encerra por falta de mão-de-obra," <em>rural</em>, foi motivado pelo <em>abandono</em> dos seus postos por parte dos 32 trabalhadores da
f&aacute;brica de<span class=""ellipsis""> ... </span>",1303632650,2011
abandono rural,http://pdm.cm-tondela.pt/pecas_escritas/001_Relatorio%20do%20Plano.pdf,https://arquivo.pt/wayback/20110520161303/http://pdm.cm-tondela.pt/pecas_escritas/001_Relatorio%20do%20Plano.pdf,Microsoft Word - 01_Relatorio do Plano_02.08.10.doc," ....................................................................................... 33 
B.2.6. A fronteira dilu&iacute;da entre o <em>rural</em> e o urbano ............................................................. 36 
B.2.7. Do <em>rural</em> e do urbano no<span class=""ellipsis""> ... </span> ............................................................................ 98 
D.1.1. Solo <em>Rural</em><span class=""ellipsis""> ... </span>",1305907983,2011
abandono rural,http://www.avante.pt/pt/1920/emfoco/110408/,https://arquivo.pt/wayback/20110522231956/http://www.avante.pt/pt/1920/emfoco/110408/,Jornal «Avante!» - Em Foco - Uma candidatura patriótica e de esquerda," da agricultura, a degrada&ccedil;&atilde;o da floresta, o <em>abandono</em> dos recursos pesqueiros, o esquecimento das<span class=""ellipsis""> ... </span> rendimentos dignos aos agricultores, promova a protec&ccedil;&atilde;o e desenvolvimento da floresta, defenda o mundo <em>rural</em> e combata o <em>abandono</em> e a desertifica&ccedil;&atilde;o do interior. Um rumo de promo&ccedil;&atilde;o da cultura e da l&iacute;ngua<span class=""ellipsis""> ... </span>",1306106396,2011
abandono rural,http://alentejanando.weblog.com.pt/arquivo/2007_05.html,https://arquivo.pt/wayback/20110120203620/http://alentejanando.weblog.com.pt/arquivo/2007_05.html,Alentejanando: maio 2007 Arquivo," resultado de tal desprecio se expresa en el <em>abandono</em> absoluto del medio <em>rural</em> y en la incapacidad desde lo<span class=""ellipsis""> ... </span> AYUNTAMIENTOS EN RESISTENCIA PARA UN MUNDO <em>RURAL</em> VIVO! &quot;Propuesta de PLATAFORMA <em>RURAL</em> / LIANZAS POR UN MUNDO <em>RURAL</em> VIVO para el d&iacute;a despu&eacute;s de las Elecciones Municipales&quot; Sabemos que en las agendas de muchos<span class=""ellipsis""> ... </span>",1295555780,2011
abandono rural,http://www.franciscolopes.pt/apresenta%C3%A7%C3%A3o-da-declara%C3%A7%C3%A3o-de-candidatura-de-francisco-lopes-1,https://arquivo.pt/wayback/20110519180114/http://www.franciscolopes.pt/apresenta%C3%A7%C3%A3o-da-declara%C3%A7%C3%A3o-de-candidatura-de-francisco-lopes-1,Apresentação da declaração de candidatura de Francisco Lopes | Francisco Lopes - Eleições Presidenci," agricultores, promova a protec&ccedil;&atilde;o e desenvolvimento da floresta, defenda o mundo <em>rural</em> e combata o <em>abandono</em> e a<span class=""ellipsis""> ... </span>, a degrada&ccedil;&atilde;o da floresta, o <em>abandono</em> dos recursos pesqueiros, o esquecimento das potencialidades do<span class=""ellipsis""> ... </span>",1305828074,2011
abandono rural,http://www.pcp.pt/apresenta%C3%A7%C3%A3o-da-declara%C3%A7%C3%A3o-de-candidatura-de-francisco-lopes-1,https://arquivo.pt/wayback/20110122174632/http://www.pcp.pt/apresenta%C3%A7%C3%A3o-da-declara%C3%A7%C3%A3o-de-candidatura-de-francisco-lopes-1,Apresentação da declaração de candidatura de Francisco Lopes | Partido Comunista Português," agricultura, a degrada&ccedil;&atilde;o da floresta, o <em>abandono</em> dos recursos pesqueiros, o esquecimento das<span class=""ellipsis""> ... </span> agricultores, promova a protec&ccedil;&atilde;o e desenvolvimento da floresta, defenda o mundo <em>rural</em> e combata o <em>abandono</em> e a desertifica&ccedil;&atilde;o do interior. Um rumo de promo&ccedil;&atilde;o da cultura e da l&iacute;ngua portuguesas e de<span class=""ellipsis""> ... </span>",1295718392,2011
abandono rural,http://alentejanando.weblog.com.pt/arquivo/2007_05.html,https://arquivo.pt/wayback/20110519180234/http://alentejanando.weblog.com.pt/arquivo/2007_05.html,Alentejanando: maio 2007 Arquivo," resultado de tal desprecio se expresa en el <em>abandono</em> absoluto del medio <em>rural</em> y en la incapacidad desde<span class=""ellipsis""> ... </span> AYUNTAMIENTOS EN RESISTENCIA PARA UN MUNDO <em>RURAL</em> VIVO! &quot;Propuesta de PLATAFORMA <em>RURAL</em> / LIANZAS POR UN MUNDO <em>RURAL</em> VIVO para el d&iacute;a despu&eacute;s de las Elecciones Municipales&quot; Sabemos que en las agendas de<span class=""ellipsis""> ... </span>",1305828154,2011
abandono rural,http://www.pcp.pt/apresenta%C3%A7%C3%A3o-da-declara%C3%A7%C3%A3o-de-candidatura-de-francisco-lopes-1,https://arquivo.pt/wayback/20110527070402/http://www.pcp.pt/apresenta%C3%A7%C3%A3o-da-declara%C3%A7%C3%A3o-de-candidatura-de-francisco-lopes-1,Apresentação da declaração de candidatura de Francisco Lopes | Partido Comunista Português," esmagamento da agricultura, a degrada&ccedil;&atilde;o da floresta, o <em>abandono</em> dos recursos pesqueiros, o<span class=""ellipsis""> ... </span> rendimentos dignos aos agricultores, promova a protec&ccedil;&atilde;o e desenvolvimento da floresta, defenda o mundo <em>rural</em> e combata o <em>abandono</em> e a desertifica&ccedil;&atilde;o do interior. Um rumo de promo&ccedil;&atilde;o da cultura e da l&iacute;ngua<span class=""ellipsis""> ... </span>",1306479842,2011
abandono rural,http://www.observatorio.pt/download.php?id=441,https://arquivo.pt/wayback/20110521214703/http://www.observatorio.pt/download.php?id=441,Microsoft Word - Relatório Final.doc,"....................................................................................... 113 
XII.3. AGRICULTURA E DESENVOLVIMENTO <em>RURAL</em><span class=""ellipsis""> ... </span>:  
 &#65533; Eixo I: Medida 1.4 &#8211; Melhoria da Articula&ccedil;&atilde;o Funcional do Sistema Urbano e <em>Rural</em>;  
 &#65533; Eixo III: Medida 3.11 &#8211; Agricultura e Desenvolvimento <em>Rural</em> (medida esta que maior peso 
apresentava na<span class=""ellipsis""> ... </span>",1306014423,2011
abandono rural,http://abrupto.blogspot.com/2009/07/os-partidos-sao-responsaveis-pelos.html,https://arquivo.pt/wayback/20110126042952/http://abrupto.blogspot.com/2009/07/os-partidos-sao-responsaveis-pelos.html,ABRUPTO,". E por a&iacute; acima. Veja-se uma biografia t&iacute;pica de aparelho partid&aacute;rio. Nascimento num meio <em>rural</em>, frequ&ecirc;ncia de curso, <em>abandono</em> do curso &quot;por fun&ccedil;&otilde;es pol&iacute;ticas&quot;, nalguns casos terminado depois numa<span class=""ellipsis""> ... </span>",1296016192,2011
abandono rural,http://abrupto.blogspot.com/2009/07/os-partidos-sao-responsaveis-pelos.html,https://arquivo.pt/wayback/20110524043006/http://abrupto.blogspot.com/2009/07/os-partidos-sao-responsaveis-pelos.html,ABRUPTO," aparelho partid&aacute;rio. Nascimento num meio <em>rural</em>, frequ&ecirc;ncia de curso, <em>abandono</em> do curso &quot;por fun&ccedil;&otilde;es<span class=""ellipsis""> ... </span>",1306211406,2011
abandono rural,http://clix.escape.pt/boa-cama/guia-hoteis/quinta-villa-mea-116690?quicktabs_1=1,https://arquivo.pt/wayback/20110708161025/http://clix.escape.pt/boa-cama/guia-hoteis/quinta-villa-mea-116690?quicktabs_1=1,Quinta de Villa Meã | Escape," hist&oacute;rico de uma aldeia secular, esquecida e completamente votada ao <em>abandono</em>. O charme deste hotel <em>rural</em><span class=""ellipsis""> ... </span> patrim&oacute;nio hist&oacute;rico de uma aldeia secular, esquecida e completamente votada ao <em>abandono</em>. O charme deste hotel <em>rural</em>, requintado e de concep&ccedil;&atilde;o irrepreens&iacute;vel, invade todos os recantos, desde os<span class=""ellipsis""> ... </span>",1310141425,2011
abandono rural,http://aeiou.escape.pt/boa-cama/guia-hoteis/quinta-villa-mea-116690,https://arquivo.pt/wayback/20110521024225/http://aeiou.escape.pt/boa-cama/guia-hoteis/quinta-villa-mea-116690,Quinta de Villa Meã | Escape," aldeia secular, esquecida e completamente votada ao <em>abandono</em>. O charme deste hotel <em>rural</em>, requintado e<span class=""ellipsis""> ... </span> hist&oacute;rico de uma aldeia secular, esquecida e completamente votada ao <em>abandono</em>. O charme deste hotel <em>rural</em>, requintado e de concep&ccedil;&atilde;o irrepreens&iacute;vel, invade todos os recantos, desde os jardins, &agrave; adega<span class=""ellipsis""> ... </span>",1305945745,2011
abandono rural,http://aeiou.escape.pt/boa-cama/guia-hoteis/quinta-villa-mea-116690,https://arquivo.pt/wayback/20110522041318/http://aeiou.escape.pt/boa-cama/guia-hoteis/quinta-villa-mea-116690,Quinta de Villa Meã | Escape," aldeia secular, esquecida e completamente votada ao <em>abandono</em>. O charme deste hotel <em>rural</em>, requintado e<span class=""ellipsis""> ... </span> hist&oacute;rico de uma aldeia secular, esquecida e completamente votada ao <em>abandono</em>. O charme deste hotel <em>rural</em>, requintado e de concep&ccedil;&atilde;o irrepreens&iacute;vel, invade todos os recantos, desde os jardins, &agrave; adega<span class=""ellipsis""> ... </span>",1306037598,2011
abandono rural,http://www.rostos.pt/definicoes/print.asp?ID=111379,https://arquivo.pt/wayback/20110603194103/http://www.rostos.pt/definicoes/print.asp?ID=111379,Rostos On-line," Num pa&iacute;s como Portugal com uma taxa actual de <em>abandono</em> escolar de 28,7%, a Ministra da Educa&ccedil;&atilde;o<span class=""ellipsis""> ... </span> para o <em>abandono</em> escolar precoce. Segundo a literatura espec&iacute;fica sobre Educa&ccedil;&atilde;o, entende-se como <em>abandono</em> precoce em sentido restrito a sa&iacute;da dos adolescentes do sistema de ensino antes da conclus&atilde;o do<span class=""ellipsis""> ... </span>",1307130063,2011
abandono rural,http://clix.escape.pt/boa-cama/guia-hoteis/quinta-villa-mea-116690?quicktabs_1=0,https://arquivo.pt/wayback/20110721032409/http://clix.escape.pt/boa-cama/guia-hoteis/quinta-villa-mea-116690?quicktabs_1=0,Quinta de Villa Meã | Escape," hist&oacute;rico de uma aldeia secular, esquecida e completamente votada ao <em>abandono</em>. O charme deste hotel <em>rural</em><span class=""ellipsis""> ... </span> patrim&oacute;nio hist&oacute;rico de uma aldeia secular, esquecida e completamente votada ao <em>abandono</em>. O charme deste hotel <em>rural</em>, requintado e de concep&ccedil;&atilde;o irrepreens&iacute;vel, invade todos os recantos, desde os<span class=""ellipsis""> ... </span>",1311218649,2011
abandono rural,http://quentalbiologico.wordpress.com/2008/09/16/11-vantagens-de-consumir-produtos-de-agricultura-biologica-no-quentalbiologico-em-rua-antero-de-quental-em-coimbra/,https://arquivo.pt/wayback/20110123074945/http://quentalbiologico.wordpress.com/2008/09/16/11-vantagens-de-consumir-produtos-de-agricultura-biologica-no-quentalbiologico-em-rua-antero-de-quental-em-coimbra/,11 vantagens em consumir produtos de Agricultura Biológica no Quentalbiológico « Agricultura Biológi," desenvolvimento da agricultura e do mundo <em>rural</em>, contradizendo o fatalismo do <em>abandono</em>, que teima em<span class=""ellipsis""> ... </span> <em>rural</em> / quentalbiologico@sapo.pt In&iacute;cio Quem somos em Coimbra Cabaz do Quental Biol&oacute;gico Agenda<span class=""ellipsis""> ... </span>",1295768985,2011
abandono rural,http://media.epdra.pt/DOCUMENTOS_PDF/Projecto_Educativo_2008_11.pdf,https://arquivo.pt/wayback/20110523054659/http://media.epdra.pt/DOCUMENTOS_PDF/Projecto_Educativo_2008_11.pdf,Microsoft Word - Projecto educativo 24 Setembro,"  
Escola Profissional de Desenvolvimento <em>Rural</em> de Abrantes 
 
 
 
Projecto Educativo 2008-2011 
2<span class=""ellipsis""> ... </span>. 
 
 A Escola Profissional de Desenvolvimento <em>Rural</em> de Abrantes &eacute; uma escola 
profissional p&uacute;blica<span class=""ellipsis""> ... </span> Profissional de Desenvolvimento <em>Rural</em> de Abrantes 
 
 
 
Projecto Educativo 2008-2011 
3
al&eacute;m de ter de se<span class=""ellipsis""> ... </span>",1306129619,2011
abandono rural,http://host.spzn.pt/mig/PN_AbandEsc_IV_propost4.pdf,https://arquivo.pt/wayback/20110123144946/http://host.spzn.pt/mig/PN_AbandEsc_IV_propost4.pdf,Microsoft Word - Plano_CBR.doc,"Plano Nacional de Preven&ccedil;&atilde;o do <em>Abandono</em> Escolar 
 
123
 
 
3.4. Apoiar uma pol&iacute;tica de articula&ccedil;&atilde;o<span class=""ellipsis""> ... </span> <em>abandono</em> 
escolar. 
 
3.4.1. Apoiar e integrar uma pol&iacute;tica global de articula&ccedil;&atilde;o para a 
preven&ccedil;&atilde;o do <em>abandono</em> escolar. 
 Promover a articula&ccedil;&atilde;o de servi&ccedil;os de diferentes minist&eacute;rios: Minist&eacute;rio da<span class=""ellipsis""> ... </span>",1295794186,2011
abandono rural,http://doutrina.vlex.pt/vid/dispensa-especial-da-pena-424505,https://arquivo.pt/wayback/20110704031919/http://doutrina.vlex.pt/vid/dispensa-especial-da-pena-424505,Dispensa e atenuação especial da pena - Disposições Aplicáveis Aos Crimes Tributários - Do Processo ," documento. Links Patrocinados Pesquisas relacionadas Folha de antecedentes Abalo de cr&eacute;dito <em>Abandono</em> coletivo de trabalho <em>Abandono</em> da causa <em>Abandono</em> de cargo <em>Abandono</em> de fun&ccedil;&atilde;o <em>Abandono</em> de incapaz <em>Abandono</em> de lar <em>Abandono</em> de lavoura &lt; Anterior Seguinte &gt; ver las p&aacute;ginas en versi&oacute;n mobile | web ver las<span class=""ellipsis""> ... </span>",1309749559,2011
abandono rural,http://www.peti.gov.pt/upload_ftp/docs/10anos_Livro4.pdf,https://arquivo.pt/wayback/20110623050918/http://www.peti.gov.pt/upload_ftp/docs/10anos_Livro4.pdf,Opúsculos PETI · Trabalho infantil por conta de outrem," terreno, pensam mesmo) ser irrever-
s&iacute;vel de <em>abandono</em> escolar;
26
PETI
 
10
 anos de combate &agrave; explor<span class=""ellipsis""> ... </span> pequena aldeia <em>rural</em> empobrecida, &eacute; oriundo de um
agregado de baixos recursos, composto por pai, m&atilde;e e<span class=""ellipsis""> ... </span>
irregularidade, com reprova&ccedil;&otilde;es, interrup&ccedil;&atilde;o dos estudos e, final-
mente, <em>abandono</em> escolar.
Como o p&atilde;o<span class=""ellipsis""> ... </span>",1308805758,2011
abandono rural,http://clickportugal.blogspot.com/2009/12/alentejo.html,https://arquivo.pt/wayback/20110630201346/http://clickportugal.blogspot.com/2009/12/alentejo.html,Click Portugal!: Alentejo," seus tesouros de arte sacra. Mas no Alentejo existem outro tipo de <em>abandono</em>, e que s&atilde;o os montes como<span class=""ellipsis""> ... </span>. Faz-me pena ver este tipo de situa&ccedil;&otilde;es em que se vai abandonando o espa&ccedil;o <em>rural</em> e se deixam ao <em>abandono</em> algumas das verdadeiras p&eacute;rolas da arquitectura t&iacute;pica portuguesa. E pensei, ao ver a riqueza da<span class=""ellipsis""> ... </span>",1309464826,2011
abandono rural,http://www.portugaldigital.com.br/,https://arquivo.pt/wayback/20110115163341/http://www.portugaldigital.com.br/,Portugal Digital," milh&otilde;es a Portugal j&aacute; est&aacute; avariado 15/01/2011 Trag&eacute;dia no RJ: &aacute;rea <em>rural</em> de Teres&oacute;polis enfrenta o <em>abandono</em> Mais not&iacute;cias Twitter RSS | O que &eacute; isso? Conhe&ccedil;a aqui as previs&otilde;es do tempo para Rio de<span class=""ellipsis""> ... </span>",1295109221,2011
abandono rural,http://agal-gz.org/blogues/index.php/amigascultura/,https://arquivo.pt/wayback/20110707222843/http://agal-gz.org/blogues/index.php/amigascultura/,A.C. Amig@s da Cultura," monocultivo do eucalipto, que necessita e depende da pasteira, refor&ccedil;a a tend&ecirc;ncia ao <em>abandono</em> e &agrave; morte do <em>rural</em> e os inc&ecirc;ndios florestais, enquanto &eacute; um obst&aacute;culo para um outro uso do monte e dos seus recursos e para fazer vi&aacute;vel um <em>rural</em> vivo. Por todo isto apoiamos sem duvid&aacute;-lo a luita contra<span class=""ellipsis""> ... </span>",1310077723,2011
abandono rural,http://www.peti.gov.pt/upload_ftp/docs/Dar_a_Volta.pdf,https://arquivo.pt/wayback/20110623061719/http://www.peti.gov.pt/upload_ftp/docs/Dar_a_Volta.pdf,," agricultura. &Eacute; 
sabido que na pequena propriedade ou no mundo <em>rural</em> de sub-
sist&ecirc;ncia permanece viva a<span class=""ellipsis""> ... </span>",1308809839,2011
abandono rural,http://media.epdra.pt/MULTIMEDIA/DOCUMENTOS/46/PLANO%5FFORM%5F08.pdf,https://arquivo.pt/wayback/20110124000028/http://media.epdra.pt/MULTIMEDIA/DOCUMENTOS/46/PLANO%5FFORM%5F08.pdf,1," DESENVOLVIMENTO <em>RURAL</em> DE ABRANTES (404329) 
 
 
 
 
 
 
 
 
 
 
 
 
 
 
 
 
 
 
 
 
 
 
 
 
 
 
 
 
 
 
 
 
 
 
PLANO DE FORMA&Ccedil;&Atilde;O 
 
2009-2011 
 
 
 
 
Escola Profissional de Desenvolvimento <em>Rural</em> de Abrantes<span class=""ellipsis""> ... </span> PR&Aacute;TICAS DE FORMA&Ccedil;&Atilde;O 
O progressivo <em>abandono</em> do &laquo;cat&aacute;logo&raquo; ou &laquo;menu&raquo; de ac&ccedil;&otilde;es, em favor de planos de<span class=""ellipsis""> ... </span>",1295827228,2011
abandono rural,http://moodle.esjd.pt/file.php/218/efa/Pessoas_e_Lugares_-_Jornal.pdf,https://arquivo.pt/wayback/20110520153900/http://moodle.esjd.pt/file.php/218/efa/Pessoas_e_Lugares_-_Jornal.pdf,Sem título-2,"
<em>rural</em>-urbano
2 PESSOAS E LUGARES | N&ordm; 41 - 2006
a ABRIR
O Pessoas e Lugares - Jornal de Anima&ccedil;&atilde;o da<span class=""ellipsis""> ... </span> positiva do mundo <em>rural</em>.
O Pessoas e Lugares tem uma periodicidade mensal e a sua
distribui&ccedil;&atilde;o &eacute;<span class=""ellipsis""> ... </span> rela&ccedil;&otilde;es entre
regi&otilde;es rurais e urbanas, diferentes dos conceitos tradicionais.
A dicotomia <em>rural</em><span class=""ellipsis""> ... </span>",1305905940,2011
abandono rural,http://ebrdl.malha.net/index2.php?option=com_content&do_pdf=1&id=80,https://arquivo.pt/wayback/20110120201720/http://ebrdl.malha.net/index2.php?option=com_content&do_pdf=1&id=80,," substancial 
altera&ccedil;&atilde;o na paisagem <em>rural</em> e na estrutura dos seus habitats, pondo 
muitas vezes em<span class=""ellipsis""> ... </span> 
resultado destes novos sistemas de utiliza&ccedil;&atilde;o do espa&ccedil;o <em>rural</em>, a 
fragmenta&ccedil;&atilde;o dos habitats<span class=""ellipsis""> ... </span> parcelas, a 
intensifica&ccedil;&atilde;o agr&iacute;cola e pecu&aacute;ria, o <em>abandono</em> das terras. 
 
  
 
Sabe-se 
hoje que<span class=""ellipsis""> ... </span>",1295554640,2011
abandono rural,http://www.parlamento.pt/DeputadoGP/Paginas/ActividadeDeputado.aspx?BID=2183&lg=XI,https://arquivo.pt/wayback/20110203234844/http://www.parlamento.pt/DeputadoGP/Paginas/ActividadeDeputado.aspx?BID=2183&lg=XI,Actividade do Deputado," <em>rural</em>. 2010-10-28 Baixa comiss&atilde;o distribui&ccedil;&atilde;o inicial generalidade Projecto de Lei 182/XI Estabelece<span class=""ellipsis""> ... </span> Comiss&atilde;o Comiss&atilde;o de Agricultura, Desenvolvimento <em>Rural</em> e Pescas Comiss&atilde;o de Educa&ccedil;&atilde;o e Ci&ecirc;ncia [Suplente<span class=""ellipsis""> ... </span> para arrendamento <em>rural</em>; Recomenda ao Governo a adop&ccedil;&atilde;o de medidas de incentivo ao aproveitamento de<span class=""ellipsis""> ... </span>",1296776924,2011
