query,original_url,archive_url,title,snippet,archive_date,year
desenvolvimento rural,http://ural.despodata.pt/geota/projecto/sudoeste.htm,https://arquivo.pt/wayback/19970228072516/http://ural.despodata.pt/geota/projecto/sudoeste.htm,Campanha da Costa Sudoeste," o <em>desenvolvimento</em> desta regi&atilde;o, tendo em aten&ccedil;&atilde;o a necessidade de proteger um patrim&oacute;nio nacional e<span class=""ellipsis""> ... </span> interdepend&ecirc;ncia com os novos desafios ambientais, como eixo essencial de <em>desenvolvimento</em> sustent&aacute;vel; Levar a debate p&uacute;blico e alargado os assuntos pol&eacute;micos para a gest&atilde;o e <em>desenvolvimento</em> da &aacute;rea; Incentivar<span class=""ellipsis""> ... </span>",0857114716,1997
desenvolvimento rural,http://www.inesca.pt/Inesc/people/npr.html,https://arquivo.pt/wayback/19970801223950/http://www.inesca.pt/Inesc/people/npr.html,Nelson Pacheco da Rocha," Engenharia Electr&oacute;nica e Telecomunica&ccedil;&otilde;es. No &acirc;mbito do Projecto EDDI (Ensino e <em>Desenvolvimento</em> de<span class=""ellipsis""> ... </span> Carvalho, &quot;Plataforma Integrada para o <em>Desenvolvimento</em> de Aplica&ccedil;&otilde;es de Gest&atilde;o de Redes sobre o Protocolo<span class=""ellipsis""> ... </span> o <em>Desenvolvimento</em> de Aplica&ccedil;&otilde;es de Gest&atilde;o de Redes sobre o Protocolo SNMP&quot;, Mestrado em Tecnologias<span class=""ellipsis""> ... </span>",0870475190,1997
desenvolvimento rural,http://www.ipamb.pt/isa.html,https://arquivo.pt/wayback/19970102210835/http://www.ipamb.pt/isa.html,IPAMB - Proj. ISA,"IPAMB - Proj. ISA Projecto &quot;O Mundo <em>Rural</em> e a Conserva&ccedil;&atilde;o da Natureza&quot; O Instituto Superior de<span class=""ellipsis""> ... </span> cora&ccedil;&atilde;o da &quot;grande cidade&quot; de Lisboa privilegia tamb&eacute;m a sua utiliza&ccedil;&atilde;o para o <em>desenvolvimento</em> da<span class=""ellipsis""> ... </span> interliga&ccedil;&atilde;o visa apoiar o <em>desenvolvimento</em> de projectos educativos e experi&ecirc;ncias pedag&oacute;gicas o mais<span class=""ellipsis""> ... </span>",0852239315,1997
desenvolvimento rural,http://www.inescn.pt/~lproenca/PV.html,https://arquivo.pt/wayback/19970715032500/http://www.inescn.pt/~lproenca/PV.html,Sistemas Fotovoltaicos," Mundo Aplica&ccedil;&otilde;es de Sistemas PV Electrifica&ccedil;&atilde;o <em>Rural</em> Aplica&ccedil;&otilde;es Profissionais Sistemas Ligados &agrave;<span class=""ellipsis""> ... </span> continua a decrescer em simult&acirc;neo com o crescimento e <em>desenvolvimento</em> de novos sistemas tornando-se cada<span class=""ellipsis""> ... </span> onde s&atilde;o exigidos sistemas silenciosos e n&atilde;o poluidores. Electrifica&ccedil;&atilde;o <em>rural</em> Fornecer electricidade<span class=""ellipsis""> ... </span>",0868937100,1997
desenvolvimento rural,http://www.iec.uminho.pt/boletim/boletim4/docentes_e.html,https://arquivo.pt/wayback/19970129232219/http://www.iec.uminho.pt/boletim/boletim4/docentes_e.html,Institut of Children's Studies,", 1996. Interven&ccedil;&atilde;o sobre O papel da m&uacute;sica no <em>desenvolvimento</em> da crian&ccedil;a: factores em jogo na experi&ecirc;ncia musical, a emo&ccedil;&atilde;o/o afecto interagindo com o cognitivo, nas Jornadas sobre O <em>desenvolvimento</em> da<span class=""ellipsis""> ... </span> Sucesso Educativo&quot;. Foi nomeado, em 12 de Agosto, conselheiro do Programa de Expans&atilde;o e <em>Desenvolvimento</em> da<span class=""ellipsis""> ... </span>",0854580139,1997
desenvolvimento rural,http://www.iec.uminho.pt/boletim/boletim4/docentes.html,https://arquivo.pt/wayback/19970129220800/http://www.iec.uminho.pt/boletim/boletim4/docentes.html,Instituto de Estudos da Criança,", 1996. Interven&ccedil;&atilde;o sobre O papel da m&uacute;sica no <em>desenvolvimento</em> da crian&ccedil;a: factores em jogo na experi&ecirc;ncia musical, a emo&ccedil;&atilde;o/o afecto interagindo com o cognitivo, nas Jornadas sobre O <em>desenvolvimento</em> da<span class=""ellipsis""> ... </span> Sucesso Educativo&quot;. Foi nomeado, em 12 de Agosto, conselheiro do Programa de Expans&atilde;o e <em>Desenvolvimento</em><span class=""ellipsis""> ... </span>",0854575680,1997
desenvolvimento rural,http://www.ccr-c.pt/CCRC/Apoios/gabinetes.html,https://arquivo.pt/wayback/19970802051313/http://www.ccr-c.pt/CCRC/Apoios/gabinetes.html,Servidor WWW da Comissao Coordenacao da Regiao Centro (CCRC)," <em>desenvolvimento</em> local, &eacute; a arquitectura. H&aacute; tamb&eacute;m car&ecirc;ncia de outras especialidades, nomeadamente de<span class=""ellipsis""> ... </span>. Para resolver esta situa&ccedil;&atilde;o de estrangulamento do <em>desenvolvimento</em> local, poderia recorrer-se a<span class=""ellipsis""> ... </span> de <em>desenvolvimento</em> e gest&atilde;o, bem como na &aacute;rea da preserva&ccedil;&atilde;o do ambiente, floresta&ccedil;&atilde;o, preven&ccedil;&atilde;o de<span class=""ellipsis""> ... </span>",0870498793,1997
desenvolvimento rural,http://dao.ccr-c.pt/CCRC/Apoios/gabinetes.html,https://arquivo.pt/wayback/19970118062701/http://dao.ccr-c.pt/CCRC/Apoios/gabinetes.html,Servidor WWW da Comissao Coordenacao da Regiao Centro (CCRC)," <em>desenvolvimento</em> local, &eacute; a arquitectura. H&aacute; tamb&eacute;m car&ecirc;ncia de outras especialidades, nomeadamente de<span class=""ellipsis""> ... </span>. Para resolver esta situa&ccedil;&atilde;o de estrangulamento do <em>desenvolvimento</em> local, poderia recorrer-se a<span class=""ellipsis""> ... </span> de <em>desenvolvimento</em> e gest&atilde;o, bem como na &aacute;rea da preserva&ccedil;&atilde;o do ambiente, floresta&ccedil;&atilde;o, preven&ccedil;&atilde;o de<span class=""ellipsis""> ... </span>",0853568821,1997
desenvolvimento rural,http://www.cm-oeiras.pt/escolas/eb123_op/concurso/projecto/OEIRAS.html,https://arquivo.pt/wayback/19970726163710/http://www.cm-oeiras.pt/escolas/eb123_op/concurso/projecto/OEIRAS.html,Untitled," carreiras de bancos destinados ao transporte de mercadorias. O <em>desenvolvimento</em> dos transportes fluvias<span class=""ellipsis""> ... </span> s&eacute;culo XVIII correponde a um per&iacute;odo de grandes transforma&ccedil;&otilde;es e <em>desenvolvimento</em> de Oeiras. A eleva&ccedil;&atilde;o<span class=""ellipsis""> ... </span>-se como importante centro comercial e de divers&otilde;es. O r&aacute;pido <em>desenvolvimento</em> dos transportes nos<span class=""ellipsis""> ... </span>",0869935030,1997
desenvolvimento rural,http://www-dh.lnec.pt/chefia/sumarios.html,https://arquivo.pt/wayback/19970221191147/http://www-dh.lnec.pt/chefia/sumarios.html,Sumários," an&aacute;lise cr&iacute;tica da falta de estrat&eacute;gia nacional para o <em>desenvolvimento</em> do sector, especialmente<span class=""ellipsis""> ... </span> sectorial e as perspectivas de evolu&ccedil;&atilde;o futura. Baptista, J. M. - Investiga&ccedil;&atilde;o e <em>desenvolvimento</em> na<span class=""ellipsis""> ... </span>. Sum&aacute;rio : Apresenta-se uma an&aacute;lise da import&acirc;ncia da investiga&ccedil;&atilde;o no <em>desenvolvimento</em> da ind&uacute;stria da<span class=""ellipsis""> ... </span>",0856552307,1997
desenvolvimento rural,http://www.drealentejo.pt/webi/SOUSEL/textos/pe3.htm,https://arquivo.pt/wayback/19971027145253/http://www.drealentejo.pt/webi/SOUSEL/textos/pe3.htm,EBI Sousel - ANÁLISE SÓCIO-CULTURAL," e de 7,6 por mil em 1991 e pelo &ecirc;xodo <em>rural</em>. Merece realce, pelo seu car&aacute;cter negativo, o facto de<span class=""ellipsis""> ... </span> Popula&ccedil;&atilde;o do Concelho 5884 9876 9235 5920 3.2. An&aacute;lise Social Sabendo-se que o <em>desenvolvimento</em> da<span class=""ellipsis""> ... </span> grande influ&ecirc;ncia entre a classe social e o <em>desenvolvimento</em> da intelig&ecirc;ncia da crian&ccedil;a. Ao n&iacute;vel da<span class=""ellipsis""> ... </span>",0877963973,1997
desenvolvimento rural,http://www.drealentejo.pt/WEBI/SOUSEL/textos/pe3.htm,https://arquivo.pt/wayback/19971028132626/http://www.drealentejo.pt/WEBI/SOUSEL/textos/pe3.htm,EBI Sousel - ANÁLISE SÓCIO-CULTURAL," e de 7,6 por mil em 1991 e pelo &ecirc;xodo <em>rural</em>. Merece realce, pelo seu car&aacute;cter negativo, o facto de<span class=""ellipsis""> ... </span> Popula&ccedil;&atilde;o do Concelho 5884 9876 9235 5920 3.2. An&aacute;lise Social Sabendo-se que o <em>desenvolvimento</em> da<span class=""ellipsis""> ... </span> grande influ&ecirc;ncia entre a classe social e o <em>desenvolvimento</em> da intelig&ecirc;ncia da crian&ccedil;a. Ao n&iacute;vel da<span class=""ellipsis""> ... </span>",0878045186,1997
desenvolvimento rural,http://www.liv-arcoiris.pt/museu_etnologia/MuseuEtnologia.html,https://arquivo.pt/wayback/19970219195508/http://www.liv-arcoiris.pt/museu_etnologia/MuseuEtnologia.html,Museu Nacional de Etnologia," aberto ao p&uacute;blico, sob a designa&ccedil;&atilde;o &laquo;Galerias da Vida <em>Rural</em>&raquo;. Relativamente a &Aacute;frica o Museu possui um<span class=""ellipsis""> ... </span> <em>desenvolvimento</em> do projecto expositivo pretendeu-se chamar a participar elementos das comunidades caboverdeana e<span class=""ellipsis""> ... </span> educativos. A exposi&ccedil;&atilde;o O Voo do Arado , uma exposi&ccedil;&atilde;o sobre a agricultura e o espa&ccedil;o <em>rural</em> portugu&ecirc;s na<span class=""ellipsis""> ... </span>",0856382108,1997
desenvolvimento rural,http://www.reit.up.pt/textos/planos/pc06.3sociologia.html,https://arquivo.pt/wayback/19970625155502/http://www.reit.up.pt/textos/planos/pc06.3sociologia.html,Plano de Curso de Sociologia," Sociologia <em>Rural</em> e Urbana Sociol. Estratif. e das Classes Sociais Sociologia do <em>Desenvolvimento</em> Op&ccedil;&atilde;o Op&ccedil;&atilde;o<span class=""ellipsis""> ... </span> Local e <em>Desenvolvimento</em> ou Trab., Emprego e Mudan&ccedil;a Social Op&ccedil;&otilde;es Est. Urbana e Conflitualid. Social<span class=""ellipsis""> ... </span>",0867254102,1997
desenvolvimento rural,http://www.reit.up.pt/v_e/textos/planos/pc06.3sociologia.html,https://arquivo.pt/wayback/19970625143948/http://www.reit.up.pt/v_e/textos/planos/pc06.3sociologia.html,Plano de Curso de Sociologia," Sociologia <em>Rural</em> e Urbana Sociol. Estratif. e das Classes Sociais Sociologia do <em>Desenvolvimento</em> Op&ccedil;&atilde;o Op&ccedil;&atilde;o<span class=""ellipsis""> ... </span> Local e <em>Desenvolvimento</em> ou Trab., Emprego e Mudan&ccedil;a Social Op&ccedil;&otilde;es Est. Urbana e Conflitualid. Social<span class=""ellipsis""> ... </span>",0867249588,1997
desenvolvimento rural,http://www.ecoarqui.pt/arquiw3/forum/jlm.html,https://arquivo.pt/wayback/19970214190135/http://www.ecoarqui.pt/arquiw3/forum/jlm.html,ArquiWWW - Forum," actuais modelos de <em>desenvolvimento</em>, como por exemplo altera&ccedil;&otilde;es clim&aacute;ticas, defloresta&ccedil;&atilde;o, chuvas &aacute;cidas<span class=""ellipsis""> ... </span> equil&iacute;brio das interven&ccedil;&otilde;es humanas com o meio natural, <em>rural</em> ou urbano, Todos n&oacute;s somos interdependentes<span class=""ellipsis""> ... </span>-estruturais e s&oacute;cio-econ&oacute;micos num desenho, integra conhecimentos b&aacute;sicos para o <em>desenvolvimento</em> de<span class=""ellipsis""> ... </span>",0855946895,1997
desenvolvimento rural,http://www.aerlis.pt/boletim/003/editorial.html,https://arquivo.pt/wayback/19970402224508/http://www.aerlis.pt/boletim/003/editorial.html,Editorial / Capa," fazem sem ter em conta uma forte vis&atilde;o territorial do <em>desenvolvimento</em>. Dois desafios se p&otilde;em hoje a<span class=""ellipsis""> ... </span>, em coopera&ccedil;&atilde;o com outros agentes de <em>desenvolvimento</em>. A recente contratualiza&ccedil;&atilde;o do RIME - Regime<span class=""ellipsis""> ... </span> &quot;pr&oacute;xima&quot; (servi&ccedil;os centrais e regionais confundem-se), mas tamb&eacute;m em que o interior <em>rural</em> deixa<span class=""ellipsis""> ... </span>",0860021108,1997
desenvolvimento rural,http://www.aerlis.pt/boletim/003/editorial.html,https://arquivo.pt/wayback/19970414215334/http://www.aerlis.pt/boletim/003/editorial.html,Editorial / Capa," fazem sem ter em conta uma forte vis&atilde;o territorial do <em>desenvolvimento</em>. Dois desafios se p&otilde;em hoje a<span class=""ellipsis""> ... </span>, em coopera&ccedil;&atilde;o com outros agentes de <em>desenvolvimento</em>. A recente contratualiza&ccedil;&atilde;o do RIME - Regime<span class=""ellipsis""> ... </span> &quot;pr&oacute;xima&quot; (servi&ccedil;os centrais e regionais confundem-se), mas tamb&eacute;m em que o interior <em>rural</em> deixa<span class=""ellipsis""> ... </span>",0861054814,1997
desenvolvimento rural,http://www.ulusiada.pt/famalicao/cee2.htm,https://arquivo.pt/wayback/19971023052636/http://www.ulusiada.pt/famalicao/cee2.htm,Licenciatura em Ciências Económicas e Empresariais,", t&eacute;cnica e cultural; - contribuir para o <em>desenvolvimento</em> da capacidade de analisar os problemas das<span class=""ellipsis""> ... </span> Economia dos Mercados Agr&iacute;olas e Alimentares 1&ordm; Sem - - 4 <em>Desenvolvimento</em> e Pol&iacute;ticas Agr&iacute;colas 1<span class=""ellipsis""> ... </span>-alimentar 2&ordm; Sem - - 4 Gest&atilde;o dos Solos e do Ambiente <em>Rural</em> 2&ordm; Sem - - 4 Est&aacute;gio* quinto ano (pr&oacute;<span class=""ellipsis""> ... </span>",0877584396,1997
desenvolvimento rural,http://www.jvk.pt/telepac/net/4/19.html,https://arquivo.pt/wayback/19970630193600/http://www.jvk.pt/telepac/net/4/19.html,@net 4 - Turismo," <em>rural</em> &eacute; outra das modalidades que se encontra dispon&iacute;vel na rede, assim como a obten&ccedil;&atilde;o de informa&ccedil;&atilde;o<span class=""ellipsis""> ... </span>). Adicionalmente, algumas autarquias procederam ao <em>desenvolvimento</em> de &laquo;sites regionais&raquo;, que fornecem<span class=""ellipsis""> ... </span> vocacionada para o <em>desenvolvimento</em> do turismo juvenil e estudantil, &eacute; um dos exemplos. Mas se, por outro<span class=""ellipsis""> ... </span>",0867699360,1997
desenvolvimento rural,http://www.jvk.pt/telepac/net/4/19.html,https://arquivo.pt/wayback/19971016085525/http://www.jvk.pt/telepac/net/4/19.html,@net 4 - Turismo," <em>rural</em> &eacute; outra das modalidades que se encontra dispon&iacute;vel na rede, assim como a obten&ccedil;&atilde;o de informa&ccedil;&atilde;o<span class=""ellipsis""> ... </span>). Adicionalmente, algumas autarquias procederam ao <em>desenvolvimento</em> de &laquo;sites regionais&raquo;, que fornecem<span class=""ellipsis""> ... </span> vocacionada para o <em>desenvolvimento</em> do turismo juvenil e estudantil, &eacute; um dos exemplos. Mas se, por outro<span class=""ellipsis""> ... </span>",0876992125,1997
desenvolvimento rural,http://www.eseset.pt/cede/africa/zips.html,https://arquivo.pt/wayback/19970215001042/http://www.eseset.pt/cede/africa/zips.html,ZIPs,"ZIPs Centro de Estudos para o <em>Desenvolvimento</em> Educativo Folha do CEDE 2 - Novembro/Dezembro 95 AS<span class=""ellipsis""> ... </span> un&amp;acircnimes em reconhecer a neces--sidade das ZIP's como meio de promover o <em>desenvolvimento</em> profissional do<span class=""ellipsis""> ... </span>, urbana e <em>rural</em> &#150; podendo, s&oacute; em parte, ser vistas como um prolongamento da estrutura de<span class=""ellipsis""> ... </span>",0855965442,1997
desenvolvimento rural,http://www.ecoarqui.pt/arquiw3/forum/jlm.html,https://arquivo.pt/wayback/19970617075725/http://www.ecoarqui.pt/arquiw3/forum/jlm.html,ArquiWWW - Forum," actuais modelos de <em>desenvolvimento</em>, como por exemplo altera&ccedil;&otilde;es clim&aacute;ticas, defloresta&ccedil;&atilde;o, chuvas &aacute;cidas<span class=""ellipsis""> ... </span> equil&iacute;brio das interven&ccedil;&otilde;es humanas com o meio natural, <em>rural</em> ou urbano, Todos n&oacute;s somos interdependentes<span class=""ellipsis""> ... </span>-estruturais e s&oacute;cio-econ&oacute;micos num desenho, integra conhecimentos b&aacute;sicos para o <em>desenvolvimento</em> de<span class=""ellipsis""> ... </span>",0866534245,1997
desenvolvimento rural,http://www.madinfo.pt/dupla/objectivos.html,https://arquivo.pt/wayback/19970507123922/http://www.madinfo.pt/dupla/objectivos.html,DUPLA - Objectivos," optimizados em termos de tempos, custos e transtorno para os utentes. Ao nivel do tecido <em>rural</em>, o<span class=""ellipsis""> ... </span> no <em>desenvolvimento</em> de solu&ccedil;&otilde;es inform&aacute;ticas e planeamento. Obter uma estrutura financeira capaz de suportar os custos de <em>desenvolvimento</em> de um projecto com esta envergadura. Constituir uma empresa<span class=""ellipsis""> ... </span>",0863008762,1997
desenvolvimento rural,http://www.ulusiada.pt/famalicao/cee2.htm,https://arquivo.pt/wayback/19970604053508/http://www.ulusiada.pt/famalicao/cee2.htm,Licenciatura em Ciências Económicas e Empresariais,", t&eacute;cnica e cultural; - contribuir para o <em>desenvolvimento</em> da capacidade de analisar os problemas das<span class=""ellipsis""> ... </span> Agr&iacute;olas e Alimentares 1&ordm; Sem - - 4 <em>Desenvolvimento</em> e Pol&iacute;ticas Agr&iacute;colas 1&ordm; Sem - - 4 Gest&atilde;o<span class=""ellipsis""> ... </span> Gest&atilde;o dos Solos e do Ambiente <em>Rural</em> 2&ordm; Sem - - 4 Est&aacute;gio* quinto ano (pr&oacute;-gradua&ccedil;&atilde;o - variante<span class=""ellipsis""> ... </span>",0865402508,1997
desenvolvimento rural,http://www.fish.pt/feira/feira02.html,https://arquivo.pt/wayback/19970705081821/http://www.fish.pt/feira/feira02.html,História do concelho de Santa Maria da Feira,", evidenciaram-se tr&ecirc;s p&oacute;los de <em>desenvolvimento</em> na Terra de Santa Maria: o Mosteiro de Cucuj&atilde;es, o Mosteiro de<span class=""ellipsis""> ... </span> <em>rural</em> a par com as &quot;casas de brasileiros&quot;, do &iacute;nicio deste s&eacute;culo, reflexo do grande fluxo emigrat&oacute;rio<span class=""ellipsis""> ... </span> de <em>desenvolvimento</em>. Copyright &copy; 1996 f.i.s.h., Consultores Lda. Rua Cidade de Liverpool, 25 C/V Esq<span class=""ellipsis""> ... </span>",0868090701,1997
desenvolvimento rural,http://www.fish.pt/feira/feira02.html,https://arquivo.pt/wayback/19970126122459/http://www.fish.pt/feira/feira02.html,História do concelho de Santa Maria da Feira," <em>desenvolvimento</em>: O Mosteiro de Cucuj&atilde;es, o Mosteiro de Arouca e o Castelo da Feira, ex-libris desta vasta<span class=""ellipsis""> ... </span> do passar do tempo. Palacetes e solares pontuam a paisagem urbana e <em>rural</em> a par com as &quot;casas de<span class=""ellipsis""> ... </span> Am&eacute;rica do Sul. Hoje, esta vasta regi&atilde;o &eacute; um dos grandes p&oacute;los nacionais de <em>desenvolvimento</em><span class=""ellipsis""> ... </span>",0854281499,1997
desenvolvimento rural,http://www.madinfo.pt/organismos/cmsv/frances2.htm,https://arquivo.pt/wayback/19970507131800/http://www.madinfo.pt/organismos/cmsv/frances2.htm,ITINERAIRE OU DORMIR - AUBERGES ET MAISONS RURALES,": 846073 4 T1 - 4 chambres Autres Services: Tourisme dans llesPace <em>rural</em> CASA DA PIEDADE Laranial 9240 S&Atilde;O VICENTE Telef: 842042 / Fax: 846044 8 chambres autres services: Tourisme dans l'espace <em>rural</em> CASA<span class=""ellipsis""> ... </span>. <em>Desenvolvimento</em> da Costa Norte da Madeira 842135 Casa da Cultura - S&atilde;o Vicente 842205 Grupo Coral de S&atilde;o<span class=""ellipsis""> ... </span>",0863011080,1997
desenvolvimento rural,http://www.ipamb.pt/parte3.html,https://arquivo.pt/wayback/19970102211727/http://www.ipamb.pt/parte3.html,parte3,", traduzindo um ambiente <em>rural</em> sem fontes poluidoras de assinalar. &Aacute;guas Os dados dispon&iacute;veis sobre a<span class=""ellipsis""> ... </span> <em>rural</em> em que as principais fontes de ru&iacute;do s&atilde;o as EN's 206, 102 e 102-1, de reduzida import&acirc;ncia. Todos<span class=""ellipsis""> ... </span> potencialidades) &eacute; considerado nele que o <em>desenvolvimento</em> municipal se deve fazer atrav&eacute;s de 3 eixos<span class=""ellipsis""> ... </span>",0852239847,1997
desenvolvimento rural,http://netizens.hpv.pt/rnatario/links.htm,https://arquivo.pt/wayback/19970714102735/http://netizens.hpv.pt/rnatario/links.htm,Navegar na Floresta - links," Wales <em>Rural</em> Fire Service - Alguma informa&ccedil;&atilde;o muito interessante sobre como proteger habita&ccedil;&otilde;es, quando<span class=""ellipsis""> ... </span> AAIR - Estudos de 3 factores abi&oacute;ticos que influenciam o <em>desenvolvimento</em> das florestas: Fogo, Vento e<span class=""ellipsis""> ... </span> florestais na regi&atilde;o centro de Portugal FIRES - <em>Desenvolvimento</em> dum instrumento baseado em sistemas<span class=""ellipsis""> ... </span>",0868876055,1997
desenvolvimento rural,http://www.multi.pt/azores/raa/pg_acorcong1.html,https://arquivo.pt/wayback/19971024144255/http://www.multi.pt/azores/raa/pg_acorcong1.html,Região Autónoma dos Açores," no sentido de orientar e apoiar eficazmente o <em>desenvolvimento</em>, e a import&acirc;ncia de que se reveste no<span class=""ellipsis""> ... </span> arranque para o <em>desenvolvimento</em> se revelaram mais importantes e eficazes os factores ex&oacute;genos que os<span class=""ellipsis""> ... </span> arranque do processo de <em>desenvolvimento</em>; 8. Considerando o poder econ&oacute;mico, a capacidade tecnol&oacute;gica e<span class=""ellipsis""> ... </span>",0877704175,1997
desenvolvimento rural,http://www.multi.pt/azores/raa/pg_acorcong1.html,https://arquivo.pt/wayback/19970624030432/http://www.multi.pt/azores/raa/pg_acorcong1.html,Região Autónoma dos Açores," no sentido de orientar e apoiar eficazmente o <em>desenvolvimento</em>, e a import&acirc;ncia de que se reveste no<span class=""ellipsis""> ... </span> arranque para o <em>desenvolvimento</em> se revelaram mais importantes e eficazes os factores ex&oacute;genos que os<span class=""ellipsis""> ... </span> arranque do processo de <em>desenvolvimento</em>; 8. Considerando o poder econ&oacute;mico, a capacidade tecnol&oacute;gica e<span class=""ellipsis""> ... </span>",0867121472,1997
desenvolvimento rural,http://bbs.sce.fct.unl.pt/cantinho/livros.htm,https://arquivo.pt/wayback/19971224211239/http://bbs.sce.fct.unl.pt/cantinho/livros.htm,Livros,", professores, pais, etc. no sentido de os esclarecer e apoiar no <em>desenvolvimento</em> desta alternativa<span class=""ellipsis""> ... </span> modelo estrat&eacute;gico de <em>desenvolvimento</em> adaptado e com as principais condicionantes do nosso Sistema<span class=""ellipsis""> ... </span>, no <em>desenvolvimento</em> de um olhar perif&eacute;rico sobre o processo de escolariza&ccedil;&atilde;o e no apetrechamento<span class=""ellipsis""> ... </span>",0882997959,1997
desenvolvimento rural,http://www-dh.lnec.pt/chefia/publicacoes.html,https://arquivo.pt/wayback/19970221174703/http://www-dh.lnec.pt/chefia/publicacoes.html,Publicações,". M. - Investiga&ccedil;&atilde;o e <em>desenvolvimento</em> na ind&uacute;stria da &aacute;gua (4 p&aacute;g.). Comunica&ccedil;&atilde;o &agrave;s 3&ordf;s Jornadas da<span class=""ellipsis""> ... </span> instrumentos de apoio a uma pol&iacute;tica de <em>desenvolvimento</em> sustentado em saneamento b&aacute;sico (55 p&aacute;g.). Relat&oacute;rio<span class=""ellipsis""> ... </span> abastecimento de &aacute;gua e o saneamento <em>rural</em> em S. Tom&eacute; e Pr&iacute;ncipe (48 p&aacute;g.). Relat&oacute;rio 224/92-NHS do LNEC<span class=""ellipsis""> ... </span>",0856547223,1997
desenvolvimento rural,http://www.ccr-c.pt/CCRC/Analises/sectorial.html,https://arquivo.pt/wayback/19970802051233/http://www.ccr-c.pt/CCRC/Analises/sectorial.html,Servidor WWW da Comissao Coordenacao da Regiao Centro (CCRC)," curso no &acirc;mbito dos projectos integrados na Rede Europeia de Turismo <em>Rural</em> (RESET / DG XVI). Trata-se<span class=""ellipsis""> ... </span> <em>desenvolvimento</em> do pr&oacute;prio sector, entendido como sector ligado a um produto de qualidade e culturalmente rico<span class=""ellipsis""> ... </span> potencialidades existentes quer pelo <em>desenvolvimento</em> verificado nos &uacute;ltimos anos. A Regi&atilde;o Centro, hoje com 57<span class=""ellipsis""> ... </span>",0870498753,1997
desenvolvimento rural,http://www.cet.pt/historial/P_50_55.HTM,https://arquivo.pt/wayback/19971021034824/http://www.cet.pt/historial/P_50_55.HTM,Período de 1950 a 1955," uma fase de <em>desenvolvimento</em> de projectos de certa envergadura, basicamente no campo da automatiza&ccedil;&atilde;o <em>rural</em>, o que fez com que, passados alguns anos, e, como resultado deste esfor&ccedil;o, Portugal se<span class=""ellipsis""> ... </span>",0877405704,1997
desenvolvimento rural,http://www.cet.pt/historial/p_50_55.htm,https://arquivo.pt/wayback/19971021035749/http://www.cet.pt/historial/p_50_55.htm,Período de 1950 a 1955," uma fase de <em>desenvolvimento</em> de projectos de certa envergadura, basicamente no campo da automatiza&ccedil;&atilde;o <em>rural</em>, o que fez com que, passados alguns anos, e, como resultado deste esfor&ccedil;o, Portugal se<span class=""ellipsis""> ... </span>",0877406269,1997
desenvolvimento rural,http://www.ecclesia.pt/agencia/3abril97/agenda.htm,https://arquivo.pt/wayback/19970702155848/http://www.ecclesia.pt/agencia/3abril97/agenda.htm,Agência Ecclesia - Agenda," forma&ccedil;&atilde;o da Ac&ccedil;&atilde;o cat&oacute;lica <em>Rural</em>, em Braga. * Encontro Interdiocesano da LOC, na Casa do Vilar. *<span class=""ellipsis""> ... </span>: &quot;<em>Desenvolvimento</em> local - uma porta para a esperan&ccedil;a&quot;, por Prof. Rog&eacute;rio Roque Amaro * Na Diocese de<span class=""ellipsis""> ... </span>",0867859128,1997
