query,original_url,archive_url,title,snippet,archive_date,year
desenvolvimento rural,http://www.esb.ucp.pt/biblio/fi-inf/maio.htm,https://arquivo.pt/wayback/19970624073648/http://www.esb.ucp.pt/biblio/fi-inf/maio.htm,,": gest&atilde;o de recursos &nbsp; Economia <em>rural</em>: <em>desenvolvimento</em> &nbsp; Organizados por: CIHEAM (Centre<span class=""ellipsis""> ... </span>",0867137808,1997
desenvolvimento rural,http://www.ist.utl.pt/ist/servs/org.html,https://arquivo.pt/wayback/19970625161008/http://www.ist.utl.pt/ist/servs/org.html,Organismos Estatais:,"Organismos Estatais: Minist&eacute;rio da Educa&ccedil;&atilde;o Minist&eacute;rio da Ci&ecirc;ncia e Tecnologia INFOCID-Informa&ccedil;&atilde;o ao Cidad&atilde;o Direc&ccedil;&atilde;o Geral do Ambiente CTT-Correios de Portugal DEMQE-Dep.Estat&iacute;stica, Min. para a Qualifica&ccedil;&atilde;o e Emprego IEADR-Instituto de Estruturas Agr&aacute;rias e <em>Desenvolvimento</em> <em>Rural</em> INAG-Instituto da<span class=""ellipsis""> ... </span>",0867255008,1997
desenvolvimento rural,http://www.ipq.pt/ingles/lstons_ing.html,https://arquivo.pt/wayback/19971008123748/http://www.ipq.pt/ingles/lstons_ing.html,Sectoral Standardisation Bodies List," Agr&aacute;rias e <em>Desenvolvimento</em> <em>Rural</em> 2 Tapada da Ajuda 1300 LISBOA Telef. (01) 364 35 55 IEP Instituto<span class=""ellipsis""> ... </span>",0876314268,1997
desenvolvimento rural,http://www.jnoticias.pt/text63.htm,https://arquivo.pt/wayback/19971011081233/http://www.jnoticias.pt/text63.htm,JN Editorial - text63," falar numa parte importante - o <em>desenvolvimento</em> <em>rural</em>-, que &eacute; uma novidade nas propostas da<span class=""ellipsis""> ... </span> adicionais por parte da UE, mas tamb&eacute;m mecanismos propulsores do <em>desenvolvimento</em> <em>rural</em> nessas<span class=""ellipsis""> ... </span>",0876557553,1997
desenvolvimento rural,http://www.ipq.pt/lstons.html,https://arquivo.pt/wayback/19970121032322/http://www.ipq.pt/lstons.html,Lista de Organismos de Normalização Sectorial,") 7211000 Fax (01) 7211001 IEADR Instituto das Estruturas Agr&aacute;rias e <em>Desenvolvimento</em> <em>Rural</em> 2 Tapada da<span class=""ellipsis""> ... </span>",0853817002,1997
desenvolvimento rural,http://www.tribunapress.pt/docs/actleg.htm,https://arquivo.pt/wayback/19971013002554/http://www.tribunapress.pt/docs/actleg.htm,Actualidade: Legislação," /PORTARIA Uma portaria dos Minist&eacute;rios da Agricultura <em>Desenvolvimento</em> <em>Rural</em> Sa&uacute;de e Ambiente (922/97) fixa<span class=""ellipsis""> ... </span>",0876702354,1997
desenvolvimento rural,http://www.pgr.pt/pagpor/publica/relpgr/audjur1.html,https://arquivo.pt/wayback/19970227141936/http://www.pgr.pt/pagpor/publica/relpgr/audjur1.html,Relatório anual da P.G.R. - Auditores jurídicos,"-Minist&eacute;rio do Com&eacute;rcio e Turismo) 4. 9. Minist&eacute;rio da Agricultura, <em>Desenvolvimento</em> <em>Rural</em> e das<span class=""ellipsis""> ... </span> da Rep&uacute;blica, a seis concursos p&uacute;blicos. 4. 9. Minist&eacute;rio da Agricultura, do <em>Desenvolvimento</em> <em>Rural</em> e<span class=""ellipsis""> ... </span> passou a designar-se Minist&eacute;rio da Agricultura, do <em>Desenvolvimento</em> <em>Rural</em> e das Pescas, cujo diploma<span class=""ellipsis""> ... </span>",0857053176,1997
desenvolvimento rural,http://www.centroatl.pt/netnews/nn_ano1/edicao01/nn1_domi.html,https://arquivo.pt/wayback/19970525141416/http://www.centroatl.pt/netnews/nn_ano1/edicao01/nn1_domi.html,net.News Nº1 de 30 de Abril de 1996 - Domínios Portugueses," Conserva&ccedil;&atilde;o da Natureza ieadr.pt Instituto de Estruturas Agr&aacute;rias e <em>Desenvolvimento</em> <em>Rural</em> ifilp.pt Instituto<span class=""ellipsis""> ... </span> de <em>Desenvolvimento</em> de Software, SA editar.pt Editar Lda. ef.pt EF - Empresa de Forma&ccedil;&atilde;o em<span class=""ellipsis""> ... </span> <em>Desenvolvimento</em> de Electr&oacute;nica, SA embital.pt Embaixada de It&aacute;lia emti.pt Empresa Moderna de Tradu&ccedil;&otilde;es e<span class=""ellipsis""> ... </span>",0864569656,1997
desenvolvimento rural,http://www.obsambiente.pt/adas/fapas.html,https://arquivo.pt/wayback/19970120100339/http://www.obsambiente.pt/adas/fapas.html,FAPAS - FUNDO PARA A PROTECÇÃO DOS ANIMAIS SELVAGENS," <em>Desenvolvimento</em> <em>Rural</em> sobre a problem&aacute;tica da ca&ccedil;a. a) A necessidade de coordena&ccedil;&atilde;o e conformidade entre a<span class=""ellipsis""> ... </span> responsabilidade do Instituto de Estruturas Agr&aacute;rias e <em>Desenvolvimento</em> <em>Rural</em> (IEADR), abrange uma &aacute;rea<span class=""ellipsis""> ... </span> Minist&eacute;rio da Agricultura, atrav&eacute;s do Instituto de Estruturas Agr&aacute;rias e <em>Desenvolvimento</em> <em>Rural</em>, dividir<span class=""ellipsis""> ... </span>",0853754619,1997
desenvolvimento rural,http://ecclesia.pt/2outubro/nacional.htm,https://arquivo.pt/wayback/19970223104521/http://ecclesia.pt/2outubro/nacional.htm,Agência Ecclesia - Nacional," XXI, criada para promover o <em>desenvolvimento</em> <em>rural</em> na regi&atilde;o do Oeste, apoia muitas actividades dos<span class=""ellipsis""> ... </span> de utiliza&ccedil;&atilde;o e ir&aacute; tamb&eacute;m prestar mais servi&ccedil;os para o <em>desenvolvimento</em> das popula&ccedil;&otilde;es da regi&atilde;o<span class=""ellipsis""> ... </span>",0856694721,1997
desenvolvimento rural,http://www.exponor.pt/ruralshow/rural.pdf,https://arquivo.pt/wayback/19970704020542/http://www.exponor.pt/ruralshow/rural.pdf,rural.pdf,"<em>RURAL</em> SHOW{97
FESTIVAL DO  MUNDO <em>RURAL</em>
DOSSIER DE IMPRENSA
9 a 13 de Julho 1997
2
<em>RURAL</em> SHOW{97
FESTIVAL DO  MUNDO <em>RURAL</em>
0. &Iacute;NDICE
P&aacute;g.
1. <em>RURAL</em> SHOW&#8217;97 EM S&Iacute;NTESE 3
2. TEXTO INFORMATIVO 4
3. ACTIVIDADES PARALELAS 6
4. O QUE SE EXP&Otilde;E 8
5. EXPONOR - FEIRA INTERNACIONAL DO PORTO 9
3
<em>RURAL</em> SHOW{97<span class=""ellipsis""> ... </span>",0867981942,1997
desenvolvimento rural,http://www.exponor.pt/ruralshow/equus.html,https://arquivo.pt/wayback/19970704020049/http://www.exponor.pt/ruralshow/equus.html,Rural Show / Equus,"<em>Rural</em> Show / Equus &nbsp; (c) Exponor , 1997 info@exponor.pt Sal&atilde;o Internacional do Cavalo Pela primeira<span class=""ellipsis""> ... </span> iniciativas complementare, fazendo jus ao franco <em>desenvolvimento</em> que este sector vem preconizando<span class=""ellipsis""> ... </span> programa de iniciativas complementares e de anima&ccedil;&atilde;o, fazendo jus ao franco <em>desenvolvimento</em> que este<span class=""ellipsis""> ... </span>",0867981649,1997
desenvolvimento rural,http://helios.cnig.pt/~jmachado/rural/rural.html,https://arquivo.pt/wayback/19971222040033/http://helios.cnig.pt/~jmachado/rural/rural.html,,"MONITORING AND MANAGING CHANGES IN <em>RURAL</em> MARGINAL AREAS A COMPARATIVE RESEARCH Prazo : 1994-1997 ENTIDADES PARTICIPANTES Centro de Estudos de Sociologia (FSCH-UNL) N&uacute;cleo de Estudos Rurais da<span class=""ellipsis""> ... </span> <em>desenvolvimento</em> da &aacute;reas marginais. Neste projecto participam equipas de investiga&ccedil;&atilde;o de tr&ecirc;s pa&iacute;ses<span class=""ellipsis""> ... </span>",0882763233,1997
desenvolvimento rural,http://www.pgr.pt/pagpor/noticias/efemeride/ccivil/p1395d.html,https://arquivo.pt/wayback/19970227144401/http://www.pgr.pt/pagpor/noticias/efemeride/ccivil/p1395d.html,Parecer 13/95 - Fundação Aga Khan Portugal," para o progresso <em>rural</em>, o <em>desenvolvimento</em> s&oacute;cio-econ&oacute;mico e a moderniza&ccedil;&atilde;o das &aacute;reas rurais para o<span class=""ellipsis""> ... </span> rendimentos e os bens devem ser afectados &agrave; promo&ccedil;&atilde;o e ao <em>desenvolvimento</em> das diversas actividades<span class=""ellipsis""> ... </span> al&iacute;nea a) do n&ordm; 3, os seguintes fins que lhe s&atilde;o cometidos : &quot;(i) Contribuir para o <em>desenvolvimento</em> da<span class=""ellipsis""> ... </span>",0857054641,1997
desenvolvimento rural,http://www.crpgaia.pt/portug/inov/azara/index.html,https://arquivo.pt/wayback/19970713093714/http://www.crpgaia.pt/portug/inov/azara/index.html,CRPG - Inovação e Desenvolvimento / AZARA,"CRPG - Inova&ccedil;&atilde;o e <em>Desenvolvimento</em> / AZARA AZARA &quot;Centro de Recursos para a Inova&ccedil;&atilde;o Empresarial<span class=""ellipsis""> ... </span> <em>desenvolvimento</em> Organiza&ccedil;&atilde;o de um Centro de Servi&ccedil;os Comuns Concep&ccedil;&atilde;o de forma&ccedil;&atilde;o em gest&atilde;o para criadores<span class=""ellipsis""> ... </span> Parceiros: Mancomunidad del Somontano (Espanha) Centro de Desarollo <em>Rural</em> Serrania de Ronda (Espanha<span class=""ellipsis""> ... </span>",0868786634,1997
desenvolvimento rural,http://www.nst.pt/ice/iceadele.html,https://arquivo.pt/wayback/19970704170628/http://www.nst.pt/ice/iceadele.html,ICE - ADELE (Associação Europeia)," no m&ecirc;s de Julho de 1994 &agrave; margem do II Encontro de &quot;Educa&ccedil;&atilde;o e <em>Desenvolvimento</em> em Meio <em>Rural</em>&quot; onde se<span class=""ellipsis""> ... </span> crian&ccedil;as do meio <em>rural</em> galego, criando as bases para o <em>desenvolvimento</em> das capacidades, aquisi&ccedil;&otilde;es de<span class=""ellipsis""> ... </span> lucrativos que re&uacute;ne projectos e associa&ccedil;&otilde;es da Europa com interven&ccedil;&atilde;o na &aacute;rea do <em>desenvolvimento</em><span class=""ellipsis""> ... </span>",0868035988,1997
desenvolvimento rural,http://www.uc.pt/Prospecto/feuc.dout.html,https://arquivo.pt/wayback/19971010081206/http://www.uc.pt/Prospecto/feuc.dout.html,Doutoramentos," Econ&oacute;mica e Social Sociologia <em>Rural</em> e do <em>Desenvolvimento</em> Direito Econ&oacute;mico Especialidade: Economia de<span class=""ellipsis""> ... </span> (Disciplinas Afins) Teoria Econ&oacute;mica Economia do Crescimento e <em>Desenvolvimento</em> Economia Industrial Planeamento e Avalia&ccedil;&atilde;o de Projectos Economia Regional Especialidade: <em>Desenvolvimento</em> e Pol&iacute;tica Econ&oacute;mica<span class=""ellipsis""> ... </span>",0876471126,1997
desenvolvimento rural,http://www.uc.pt/Prospecto/feuc.dout.html,https://arquivo.pt/wayback/19970618160549/http://www.uc.pt/Prospecto/feuc.dout.html,Doutoramentos," Econ&oacute;mica e Social Sociologia <em>Rural</em> e do <em>Desenvolvimento</em> Direito Econ&oacute;mico Especialidade: Economia de<span class=""ellipsis""> ... </span> (Disciplinas Afins) Teoria Econ&oacute;mica Economia do Crescimento e <em>Desenvolvimento</em> Economia Industrial Planeamento e Avalia&ccedil;&atilde;o de Projectos Economia Regional Especialidade: <em>Desenvolvimento</em> e Pol&iacute;tica Econ&oacute;mica<span class=""ellipsis""> ... </span>",0866649949,1997
desenvolvimento rural,http://www.nst.pt/ice/iceadest.html,https://arquivo.pt/wayback/19970704170713/http://www.nst.pt/ice/iceadest.html,ICE - Actividades em destaque," iniciativa teve o apoio do IIE, medida 3 do SIQE. ) IV Encontro Nacional de Educa&ccedil;&atilde;o e <em>Desenvolvimento</em> em Meio <em>Rural</em> Reunido entre 4 e 6 de Julho, em Nelas, o IV Encontro Nacional de Educa&ccedil;&atilde;o e <em>Desenvolvimento</em> em Meio <em>Rural</em> debru&ccedil;ou-se sobre quatro temas considerados estrat&eacute;gicos para a implementa&ccedil;&atilde;o, em<span class=""ellipsis""> ... </span>",0868036033,1997
desenvolvimento rural,http://www.crpgaia.pt/portug/consult/came/index.html,https://arquivo.pt/wayback/19970713093620/http://www.crpgaia.pt/portug/consult/came/index.html,CRPG - Consultadoria em Gestão / CAME,". Projectos enquadrados no <em>desenvolvimento</em> local e <em>rural</em>, trazendo uma mais-valia para as &aacute;reas onde se<span class=""ellipsis""> ... </span>. Elabora&ccedil;&atilde;o de anteprojectos / recolha de informa&ccedil;&atilde;o &uacute;til. Apoio ao <em>desenvolvimento</em> do plano de<span class=""ellipsis""> ... </span>",0868786580,1997
desenvolvimento rural,http://www.dn.pt/ige/tex5ige.htm,https://arquivo.pt/wayback/19970509035224/http://www.dn.pt/ige/tex5ige.htm,DN-Sociedade," pol&iacute;ticas de incentivo ao &laquo;<em>desenvolvimento</em> regional e <em>rural</em>&raquo;, &laquo;pol&iacute;tica agr&iacute;cola comum&raquo;, &laquo;exig&ecirc;ncias<span class=""ellipsis""> ... </span>",0863149944,1997
desenvolvimento rural,http://centro.hpv.pt/mpt/boletim.htm,https://arquivo.pt/wayback/19970528121632/http://centro.hpv.pt/mpt/boletim.htm,MPT - Movimento o Partido da Terra," pessoas e correntes de opini&atilde;o - <em>desenvolvimento</em> local, mundo <em>rural</em>, ecologia, ambiente, direitos<span class=""ellipsis""> ... </span> democr&aacute;tica das institui&ccedil;&otilde;es, de tal forma est&atilde;o agarrados a um modelo de <em>desenvolvimento</em> econ&oacute;mico-social<span class=""ellipsis""> ... </span> seu <em>desenvolvimento</em>. Sabemos que n&atilde;o &eacute; poss&iacute;vel modificar a actual sociedade e as suas vias de<span class=""ellipsis""> ... </span>",0864821792,1997
desenvolvimento rural,http://centro.hpv.pt/mpt/boletim.htm,https://arquivo.pt/wayback/19970401192421/http://centro.hpv.pt/mpt/boletim.htm,MPT - Movimento o Partido da Terra," pessoas e correntes de opini&atilde;o - <em>desenvolvimento</em> local, mundo <em>rural</em>, ecologia, ambiente, direitos<span class=""ellipsis""> ... </span> democr&aacute;tica das institui&ccedil;&otilde;es, de tal forma est&atilde;o agarrados a um modelo de <em>desenvolvimento</em> econ&oacute;mico-social<span class=""ellipsis""> ... </span> seu <em>desenvolvimento</em>. Sabemos que n&atilde;o &eacute; poss&iacute;vel modificar a actual sociedade e as suas vias de<span class=""ellipsis""> ... </span>",0859922661,1997
desenvolvimento rural,http://www.si.fct.unl.pt/projects/www-amb/pnssm/poturist.htm,https://arquivo.pt/wayback/19970802155344/http://www.si.fct.unl.pt/projects/www-amb/pnssm/poturist.htm,POTURIST," religioso - turismo de incentivos - turismo ligado ao golfe - turismo na Grande Cidade - turismo <em>rural</em><span class=""ellipsis""> ... </span> Casas de Turismo no Espa&ccedil;o <em>Rural</em> s&atilde;o, recentemente, um novo tipo de oferta. Algumas est&atilde;o ainda em fase de aprecia&ccedil;&atilde;o, outras aprovadas (M.C.T./D.G.T., 1991). Turismo e <em>Desenvolvimento</em> O turismo no espa&ccedil;o<span class=""ellipsis""> ... </span>",0870537224,1997
desenvolvimento rural,http://www.si.fct.unl.pt/projects/www-amb/pnssm/poturist.htm,https://arquivo.pt/wayback/19970203000837/http://www.si.fct.unl.pt/projects/www-amb/pnssm/poturist.htm,POTURIST," religioso - turismo de incentivos - turismo ligado ao golfe - turismo na Grande Cidade - turismo <em>rural</em><span class=""ellipsis""> ... </span> Casas de Turismo no Espa&ccedil;o <em>Rural</em> s&atilde;o, recentemente, um novo tipo de oferta. Algumas est&atilde;o ainda em fase de aprecia&ccedil;&atilde;o, outras aprovadas (M.C.T./D.G.T., 1991). Turismo e <em>Desenvolvimento</em> O turismo no espa&ccedil;o<span class=""ellipsis""> ... </span>",0854928517,1997
desenvolvimento rural,http://www.caleida.pt/avilar/bdj/bdjp12b.html,https://arquivo.pt/wayback/19970206004723/http://www.caleida.pt/avilar/bdj/bdjp12b.html,INCENTIVOS CONCEDIDOS PELAS AUTORIDADES LOCAIS," organismos destinados a promover o <em>desenvolvimento</em> local, dos quais se destacam: * &quot;<em>Rural</em> Development<span class=""ellipsis""> ... </span> autoridades locais t&ecirc;m autonomia para adoptarem medidas espec&iacute;ficas de <em>desenvolvimento</em> que, de certa<span class=""ellipsis""> ... </span> se preveja, n&atilde;o s&oacute; o seu pr&oacute;prio <em>desenvolvimento</em>, mas tamb&eacute;m a preserva&ccedil;&atilde;o do meio ambiente, o bem<span class=""ellipsis""> ... </span>",0855190043,1997
desenvolvimento rural,http://www.caleida.pt/avilar/bdj/bdjp12b.html,https://arquivo.pt/wayback/19970801044452/http://www.caleida.pt/avilar/bdj/bdjp12b.html,INCENTIVOS CONCEDIDOS PELAS AUTORIDADES LOCAIS," organismos destinados a promover o <em>desenvolvimento</em> local, dos quais se destacam: * &quot;<em>Rural</em> Development<span class=""ellipsis""> ... </span> autoridades locais t&ecirc;m autonomia para adoptarem medidas espec&iacute;ficas de <em>desenvolvimento</em> que, de certa<span class=""ellipsis""> ... </span> se preveja, n&atilde;o s&oacute; o seu pr&oacute;prio <em>desenvolvimento</em>, mas tamb&eacute;m a preserva&ccedil;&atilde;o do meio ambiente, o bem<span class=""ellipsis""> ... </span>",0870410692,1997
desenvolvimento rural,http://godzila.caleida.pt/avilar/bdj/bdjp12b.html,https://arquivo.pt/wayback/19970206004723/http://godzila.caleida.pt/avilar/bdj/bdjp12b.html,INCENTIVOS CONCEDIDOS PELAS AUTORIDADES LOCAIS," organismos destinados a promover o <em>desenvolvimento</em> local, dos quais se destacam: * &quot;<em>Rural</em> Development<span class=""ellipsis""> ... </span> autoridades locais t&ecirc;m autonomia para adoptarem medidas espec&iacute;ficas de <em>desenvolvimento</em> que, de certa<span class=""ellipsis""> ... </span> se preveja, n&atilde;o s&oacute; o seu pr&oacute;prio <em>desenvolvimento</em>, mas tamb&eacute;m a preserva&ccedil;&atilde;o do meio ambiente, o bem<span class=""ellipsis""> ... </span>",0855190043,1997
desenvolvimento rural,http://www.apotec.pt/sagosto.txt,https://arquivo.pt/wayback/19971121031307/http://www.apotec.pt/sagosto.txt,," urbano e <em>rural</em>.
Esta Lei n.&ordm; 23/97 define ainda as compet&ecirc;ncias, pr&oacute;prias ou delegadas, dos &oacute;rg&atilde;os<span class=""ellipsis""> ... </span> <em>desenvolvimento</em> local cujo objecto se contenha no &acirc;mbito das suas atribui&ccedil;&otilde;es e compet&ecirc;ncias.

DECRETO<span class=""ellipsis""> ... </span> <em>rural</em> &eacute; aprovado por este diploma, que revoga o Dec.-Lei n.&ordm; 256/86 de 27.08., que regulava o turismo de<span class=""ellipsis""> ... </span>",0880081987,1997
desenvolvimento rural,http://www.min-edu.pt/gave/Doc/CRPM123.html,https://arquivo.pt/wayback/19970702064451/http://www.min-edu.pt/gave/Doc/CRPM123.html,critérios de cor.," . Documento : Aumento percentual da popula&ccedil;&atilde;o urbana, diminui&ccedil;&atilde;o relativa da popula&ccedil;&atilde;o <em>rural</em><span class=""ellipsis""> ... </span> da expans&atilde;o da revolu&ccedil;&atilde;o industrial; - circula&ccedil;&atilde;o facilitada pelo <em>desenvolvimento</em> dos transportes; - valoriza&ccedil;&atilde;o do modo de vida urbano na sociedade burguesa; - &ecirc;xodo <em>rural</em>, na sequ&ecirc;ncia das<span class=""ellipsis""> ... </span>",0867825891,1997
desenvolvimento rural,http://www.bdo.pt/bol0696a.htm,https://arquivo.pt/wayback/19970618210731/http://www.bdo.pt/bol0696a.htm,Boletim - Principal Legislação," Or&ccedil;amento do Estado Direito Econ&oacute;mico Arrendamento <em>Rural</em> Emigra&ccedil;&atilde;o Incentivos Investimento Estrangeiro<span class=""ellipsis""> ... </span> <em>RURAL</em> Valor das rendas (Portaria n&ordm; 151/96, de 14 de Maio) Fixa os valores m&aacute;ximos das rendas dos contratos de arrendamento <em>rural</em> |&Iacute;ndice| 5. EMIGRA&Ccedil;&Atilde;O Regulariza&ccedil;&atilde;o Extraordin&aacute;ria (Lei n&ordm; 17/96, de<span class=""ellipsis""> ... </span>",0866668051,1997
desenvolvimento rural,http://www.bdo.pt/bol0696a.htm,https://arquivo.pt/wayback/19971010231711/http://www.bdo.pt/bol0696a.htm,Boletim - Principal Legislação," Or&ccedil;amento do Estado Direito Econ&oacute;mico Arrendamento <em>Rural</em> Emigra&ccedil;&atilde;o Incentivos Investimento Estrangeiro<span class=""ellipsis""> ... </span> <em>RURAL</em> Valor das rendas (Portaria n&ordm; 151/96, de 14 de Maio) Fixa os valores m&aacute;ximos das rendas dos contratos de arrendamento <em>rural</em> |&Iacute;ndice| 5. EMIGRA&Ccedil;&Atilde;O Regulariza&ccedil;&atilde;o Extraordin&aacute;ria (Lei n&ordm; 17/96, de<span class=""ellipsis""> ... </span>",0876525431,1997
desenvolvimento rural,http://www.cgd.pt/sifit3/Criterio.htm,https://arquivo.pt/wayback/19970605021955/http://www.cgd.pt/sifit3/Criterio.htm,," AMBIENTAL (IE) IE = 70% A1 + 30% A2 em que: A1 = n&iacute;vel de <em>desenvolvimento</em> s&oacute;cio-econ&oacute;mico do<span class=""ellipsis""> ... </span> projecto para um <em>desenvolvimento</em> mais equilibrado do sector. a) PONTUA&Ccedil;&Atilde;O DO SUBCRIT&Eacute;RIO A A<span class=""ellipsis""> ... </span> &quot;Turismo no espa&ccedil;o <em>rural</em>&quot; em unidades hoteleiras. d) S&atilde;o considerados apenas os edif&iacute;cios classificados<span class=""ellipsis""> ... </span>",0865477195,1997
desenvolvimento rural,http://www.cgd.pt/sifit3/Criterio.htm,https://arquivo.pt/wayback/19971007172104/http://www.cgd.pt/sifit3/Criterio.htm,," AMBIENTAL (IE) IE = 70% A1 + 30% A2 em que: A1 = n&iacute;vel de <em>desenvolvimento</em> s&oacute;cio-econ&oacute;mico do<span class=""ellipsis""> ... </span> projecto para um <em>desenvolvimento</em> mais equilibrado do sector. a) PONTUA&Ccedil;&Atilde;O DO SUBCRIT&Eacute;RIO A A<span class=""ellipsis""> ... </span> &quot;Turismo no espa&ccedil;o <em>rural</em>&quot; em unidades hoteleiras. d) S&atilde;o considerados apenas os edif&iacute;cios classificados<span class=""ellipsis""> ... </span>",0876244864,1997
desenvolvimento rural,http://www.eseset.pt/ese/concelho.html,https://arquivo.pt/wayback/19970214235445/http://www.eseset.pt/ese/concelho.html,Enquadramento," DISTRITO HETEROG&Eacute;NEO A ESE de Set&uacute;bal tem procurado ser um parceiro privilegiado do <em>desenvolvimento</em><span class=""ellipsis""> ... </span>, da polariza&ccedil;&atilde;o de Lisboa e do moderno <em>desenvolvimento</em> industrial n&atilde;o urbano da pen&iacute;nsula de Set&uacute;bal<span class=""ellipsis""> ... </span>, Palmela e parte de Sesimbra. A sub-regi&atilde;o sul, predominantemente <em>rural</em>, &agrave; excep&ccedil;&atilde;o do concelho de Sines<span class=""ellipsis""> ... </span>",0855964485,1997
desenvolvimento rural,http://bayes.iseg.utl.pt/html/disciplinas/index.html,https://arquivo.pt/wayback/19971224194307/http://bayes.iseg.utl.pt/html/disciplinas/index.html,PROGRAMAS DAS DISCIPLINAS," Informa&ccedil;&atilde;o Avalia&ccedil;&atilde;o de Projectos Concep&ccedil;&atilde;o e <em>Desenvolvimento</em> Sistemas de Informa&ccedil;&atilde;o Economia 1 Economia 2 Economia Africana Economia do <em>Desenvolvimento</em> Economia da Energia Economia Europeia Economia<span class=""ellipsis""> ... </span> Gest&atilde;o Economia Portuguesa e Europeia , para Economia Economia de Recursos Humanos Economia <em>Rural</em> e<span class=""ellipsis""> ... </span>",0882992587,1997
desenvolvimento rural,http://www.distrimarketing.pt/tourism/costazul/artesana.html,https://arquivo.pt/wayback/19970715175709/http://www.distrimarketing.pt/tourism/costazul/artesana.html,Portugal - Costa Azul - Artesanato," cen&aacute;rios dominantes: o cen&aacute;rio <em>rural</em>, o cen&aacute;rio fluvial e o cen&aacute;rio maritimo. A estes tr&ecirc;s cen&aacute;rios<span class=""ellipsis""> ... </span> paisagem e recursos variados, que se vai operar a transforma&ccedil;&atilde;o dos materiais e o <em>desenvolvimento</em> de<span class=""ellipsis""> ... </span> actividade. O Mundo <em>Rural</em> Nesta regi&atilde;o, o mundo <em>rural</em> &eacute; representado pelo Alentejo e todo o interior da<span class=""ellipsis""> ... </span>",0868989429,1997
desenvolvimento rural,http://www.distrimarketing.pt/tourism/costazul/artesana.html,https://arquivo.pt/wayback/19970716132838/http://www.distrimarketing.pt/tourism/costazul/artesana.html,Portugal - Costa Azul - Artesanato," cen&aacute;rios dominantes: o cen&aacute;rio <em>rural</em>, o cen&aacute;rio fluvial e o cen&aacute;rio maritimo. A estes tr&ecirc;s cen&aacute;rios<span class=""ellipsis""> ... </span> paisagem e recursos variados, que se vai operar a transforma&ccedil;&atilde;o dos materiais e o <em>desenvolvimento</em> de<span class=""ellipsis""> ... </span> actividade. O Mundo <em>Rural</em> Nesta regi&atilde;o, o mundo <em>rural</em> &eacute; representado pelo Alentejo e todo o interior da<span class=""ellipsis""> ... </span>",0869059718,1997
desenvolvimento rural,http://portugal.hpv.pt/lisboa/agenda/agl9602/agl02fre.htm,https://arquivo.pt/wayback/19971012043354/http://portugal.hpv.pt/lisboa/agenda/agl9602/agl02fre.htm,Portugal Online: Agenda Cultural - Freguesia," car&aacute;cter r&uacute;stico e predominantemente <em>rural</em>. S&eacute;culo XIV Descobrindo nas extraordin&aacute;rias caracter&iacute;sticas naturais o principal enzima do seu <em>desenvolvimento</em>, o ent&atilde;o integrado no vast&iacute;ssimo e genericamente<span class=""ellipsis""> ... </span>. S&eacute;culo XVI Na zona arrabaldina e extra-muros &eacute; a rusticidade, o romantismo e o car&aacute;cter <em>rural</em> que<span class=""ellipsis""> ... </span>",0876630834,1997
desenvolvimento rural,http://www.despodata.pt/geota/projecto/sudoeste.htm,https://arquivo.pt/wayback/19970719132920/http://www.despodata.pt/geota/projecto/sudoeste.htm,Campanha da Costa Sudoeste," o <em>desenvolvimento</em> desta regi&atilde;o, tendo em aten&ccedil;&atilde;o a necessidade de proteger um patrim&oacute;nio nacional e<span class=""ellipsis""> ... </span> interdepend&ecirc;ncia com os novos desafios ambientais, como eixo essencial de <em>desenvolvimento</em> sustent&aacute;vel; Levar a debate p&uacute;blico e alargado os assuntos pol&eacute;micos para a gest&atilde;o e <em>desenvolvimento</em> da &aacute;rea; Incentivar<span class=""ellipsis""> ... </span>",0869318960,1997
