query,original_url,archive_url,title,snippet,archive_date,year
desenvolvimento rural,http://www.ieadr.pt/,https://arquivo.pt/wayback/19970219022832/http://www.ieadr.pt/,Direcção-Geral de Desenvolvimento Rural,"Direc&ccedil;&atilde;o-Geral de <em>Desenvolvimento</em> <em>Rural</em> &nbsp; &nbsp; &nbsp; Direc&ccedil;&atilde;o-Geral de <em>Desenvolvimento</em> <em>Rural</em> Promotora dos<span class=""ellipsis""> ... </span> &aacute;reas rurais. Integradora das iniciativas e vontades do meio <em>rural</em>. &nbsp; Minist&eacute;rio da Agricultura do <em>Desenvolvimento</em> <em>Rural</em> e das Pescas D. G. D. <em>RURAL</em> Av. Defensores de Chaves n&ordm; 6, 1000 Lisboa Tel<span class=""ellipsis""> ... </span>",0856319312,1997
desenvolvimento rural,http://www.ieadr.pt/,https://arquivo.pt/wayback/19971010095531/http://www.ieadr.pt/,Direcção-Geral de Desenvolvimento Rural,"Direc&ccedil;&atilde;o-Geral de <em>Desenvolvimento</em> <em>Rural</em> &nbsp; &nbsp; &nbsp; Direc&ccedil;&atilde;o-Geral de <em>Desenvolvimento</em> <em>Rural</em> Promotora dos<span class=""ellipsis""> ... </span> &aacute;reas rurais. Integradora das iniciativas e vontades do meio <em>rural</em>. &nbsp; Minist&eacute;rio da Agricultura do <em>Desenvolvimento</em> <em>Rural</em> e das Pescas D. G. D. <em>RURAL</em> Av. Defensores de Chaves n&ordm; 6, 1000 Lisboa Tel<span class=""ellipsis""> ... </span>",0876477331,1997
desenvolvimento rural,http://www.infocid.pt/SIAE/HTML/010-1260.html,https://arquivo.pt/wayback/19970130102921/http://www.infocid.pt/SIAE/HTML/010-1260.html,PPDR - Acções de Desenvolvimento Rural,"PPDR - Ac&ccedil;&otilde;es de <em>Desenvolvimento</em> <em>Rural</em> Programa/Ac&ccedil;&atilde;o: PPDR - Ac&ccedil;&otilde;es de <em>Desenvolvimento</em> <em>Rural</em> Objectivos: Valoriza&ccedil;&atilde;o das caracter&iacute;sticas patrimoniais e elementos de interesse hist&oacute;rico-cultural<span class=""ellipsis""> ... </span> <em>Desenvolvimento</em>. Legisla&ccedil;&atilde;o Aplic&aacute;vel: Decreto-Lei n&ordm; 34/95, de 11 de Fevereiro. Resol.Conselho Ministros<span class=""ellipsis""> ... </span>",0854620161,1997
desenvolvimento rural,http://www.infocid.pt/SIAE/HTML/010-1110.html,https://arquivo.pt/wayback/19970130102540/http://www.infocid.pt/SIAE/HTML/010-1110.html,INTERREG II - Agricultura e Desenvolvimento Rural,"INTERREG II - Agricultura e <em>Desenvolvimento</em> <em>Rural</em> Programa/Ac&ccedil;&atilde;o: INTERREG II - Agricultura e <em>Desenvolvimento</em> <em>Rural</em> Objectivos: . Promover a valoriza&ccedil;&atilde;o das potencialidades espec&iacute;ficas das zonas<span class=""ellipsis""> ... </span> comuns); . Dinamiza&ccedil;&atilde;o local e <em>rural</em> (estudos, grupos de ac&ccedil;&atilde;o local e promo&ccedil;&atilde;o do <em>desenvolvimento</em><span class=""ellipsis""> ... </span>",0854619940,1997
desenvolvimento rural,http://aeborb.isa.utl.pt/agros/eco11.html,https://arquivo.pt/wayback/19970706232919/http://aeborb.isa.utl.pt/agros/eco11.html,DESENVOLVIMENTO RURAL E GESTÃO DOS RECURSOS NATURAIS,"<em>DESENVOLVIMENTO</em> <em>RURAL</em> E GEST&Atilde;O DOS RECURSOS NATURAIS <em>DESENVOLVIMENTO</em> <em>RURAL</em> E GEST&Igrave;O DOS RECURSOS<span class=""ellipsis""> ... </span> documento constitui a contribui&ccedil;&atilde;o do Grupo de <em>Desenvolvimento</em> <em>Rural</em> e Gest&atilde;o dos Recursos Naturais para uma<span class=""ellipsis""> ... </span> <em>Desenvolvimento</em> <em>Rural</em> e da Gest&atilde;o dos Recursos Agr&aacute;rios no contexto do futuro modelo de Ensino Agr&aacute;rio em<span class=""ellipsis""> ... </span>",0868231759,1997
desenvolvimento rural,http://aeborb.isa.utl.pt/agros/eco11.html,https://arquivo.pt/wayback/19971016114800/http://aeborb.isa.utl.pt/agros/eco11.html,DESENVOLVIMENTO RURAL E GESTÃO DOS RECURSOS NATURAIS,"<em>DESENVOLVIMENTO</em> <em>RURAL</em> E GEST&Atilde;O DOS RECURSOS NATURAIS <em>DESENVOLVIMENTO</em> <em>RURAL</em> E GEST&Igrave;O DOS RECURSOS<span class=""ellipsis""> ... </span> documento constitui a contribui&ccedil;&atilde;o do Grupo de <em>Desenvolvimento</em> <em>Rural</em> e Gest&atilde;o dos Recursos Naturais para uma<span class=""ellipsis""> ... </span> <em>Desenvolvimento</em> <em>Rural</em> e da Gest&atilde;o dos Recursos Agr&aacute;rios no contexto do futuro modelo de Ensino Agr&aacute;rio em<span class=""ellipsis""> ... </span>",0877002480,1997
desenvolvimento rural,http://www.pcm.gov.pt/organizacao/membros/capoulas_santos.htm,https://arquivo.pt/wayback/19970708234301/http://www.pcm.gov.pt/organizacao/membros/capoulas_santos.htm,PCM: Organização do Governo: Sec. Est. da Agricultura e do Desenvolvimento Rural,"PCM: Organiza&ccedil;&atilde;o do Governo: Sec. Est. da Agricultura e do <em>Desenvolvimento</em> <em>Rural</em> Secret&aacute;rio de Estado da Agricultura e do <em>Desenvolvimento</em> <em>Rural</em> Lu&iacute;s Manuel CAPOULAS SANTOS Nascido em Montemor-o-Novo<span class=""ellipsis""> ... </span> projectos de <em>desenvolvimento</em> <em>rural</em> no Alentejo (1980/91). Actividade Pol&iacute;tica Vereador da C&acirc;mara<span class=""ellipsis""> ... </span>",0868405381,1997
desenvolvimento rural,http://www.pcm.gov.pt/organizacao/membros/gomes_silva.htm,https://arquivo.pt/wayback/19970708234241/http://www.pcm.gov.pt/organizacao/membros/gomes_silva.htm,"PCM: Organização do Governo: Ministro da Agricultura, do Desenvolvimento Rural e das Pescas","PCM: Organiza&ccedil;&atilde;o do Governo: Ministro da Agricultura, do <em>Desenvolvimento</em> <em>Rural</em> e das Pescas Ministro da Agricultura, do <em>Desenvolvimento</em> <em>Rural</em> e das Pescas Fernando Van-Zeller GOMES DA SILVA Nascido<span class=""ellipsis""> ... </span> 1976 - Assistente no Instituto Superior de Agronomia, cadeiras de Economia <em>Rural</em> e Gest&atilde;o e<span class=""ellipsis""> ... </span>",0868405361,1997
desenvolvimento rural,http://www.partido-socialista.pt/partido/biblioteca/contrato/cap3.htm,https://arquivo.pt/wayback/19970330182057/http://www.partido-socialista.pt/partido/biblioteca/contrato/cap3.htm,DESENVOLVIMENTO E EMPREGO," territ&oacute;rio, do ambiente e de <em>desenvolvimento</em> <em>rural</em>; de desenvolver uma nova pol&iacute;tica para as cidades<span class=""ellipsis""> ... </span> pol&iacute;tica de gest&atilde;o do territ&oacute;rio e, portanto, da pol&iacute;tica para o <em>desenvolvimento</em> do Mundo <em>Rural</em>. A<span class=""ellipsis""> ... </span> pol&iacute;tica para o <em>Desenvolvimento</em> do Mundo <em>Rural</em> e para a Agricultura apoiar-se-&aacute; no ordenamento biof&iacute;sico<span class=""ellipsis""> ... </span>",0859746057,1997
desenvolvimento rural,http://www.partido-socialista.pt/ps/partido/biblioteca/contrato/cap3.htm,https://arquivo.pt/wayback/19970709184151/http://www.partido-socialista.pt/ps/partido/biblioteca/contrato/cap3.htm,DESENVOLVIMENTO E EMPREGO," territ&oacute;rio, do ambiente e de <em>desenvolvimento</em> <em>rural</em>; de desenvolver uma nova pol&iacute;tica para as cidades<span class=""ellipsis""> ... </span> pol&iacute;tica de gest&atilde;o do territ&oacute;rio e, portanto, da pol&iacute;tica para o <em>desenvolvimento</em> do Mundo <em>Rural</em>. A<span class=""ellipsis""> ... </span> pol&iacute;tica para o <em>Desenvolvimento</em> do Mundo <em>Rural</em> e para a Agricultura apoiar-se-&aacute; no ordenamento biof&iacute;sico<span class=""ellipsis""> ... </span>",0868473711,1997
desenvolvimento rural,http://www.min-plan.pt/menu/projects/edec/edec.htm,https://arquivo.pt/wayback/19970601155235/http://www.min-plan.pt/menu/projects/edec/edec.htm,EDEC - Esquema de Desenvolvimento do Espaço Comunitario," <em>Rural</em> e das Iniciativas de <em>Desenvolvimento</em> Local. Por outro, deve ser valorizada a rede densa de<span class=""ellipsis""> ... </span>EDEC - Esquema de <em>Desenvolvimento</em> do Espa&ccedil;o Comunitario E D E C Esquema de <em>Desenvolvimento</em> do<span class=""ellipsis""> ... </span> Esquema de <em>Desenvolvimento</em> do Espa&ccedil;o Comunit&aacute;rio - EDEC tem vindo a ser feito pelo Comit&eacute; de<span class=""ellipsis""> ... </span>",0865180355,1997
desenvolvimento rural,http://www.fe.up.pt/aefewww/deq93/pi/fapas/dique.html,https://arquivo.pt/wayback/19970718232843/http://www.fe.up.pt/aefewww/deq93/pi/fapas/dique.html,Projecto de Desenvolvimento Agrícola do Baixo-Vouga Lagunar," Agr&aacute;rias e <em>Desenvolvimento</em> <em>Rural</em> (IEADR), do Minist&eacute;rio da Agricultura, abrange uma &aacute;rea de cerca de 4.000<span class=""ellipsis""> ... </span> do Instituto de Estruturas Agr&aacute;rias e <em>Desenvolvimento</em> <em>Rural</em> (IEADR), dividir este projecto em v&aacute;rias<span class=""ellipsis""> ... </span>Projecto de <em>Desenvolvimento</em> Agr&iacute;cola do Baixo-Vouga Lagunar Projecto de <em>Desenvolvimento</em> Agr&iacute;cola do<span class=""ellipsis""> ... </span>",0869268523,1997
desenvolvimento rural,http://www.freipedro.pt/tb/300596/soc4.htm,https://arquivo.pt/wayback/19970620135535/http://www.freipedro.pt/tb/300596/soc4.htm,Terras da Beira - 30/05/96 - Sociedade - UBI rural durante dois dias,"Terras da Beira - 30/05/96 - Sociedade - UBI <em>rural</em> durante dois dias 30 Mai 96 UBI <em>rural</em> durante dois dias Dois dias para falar sobre o mundo <em>rural</em>. Amanh&atilde; e s&aacute;bado a Associa&ccedil;&atilde;o Promotora de <em>Desenvolvimento</em> <em>Rural</em> Integrado da Cova da Beira (Beira Serra) e o Jornal do Fund&atilde;o organizam as Jornadas<span class=""ellipsis""> ... </span>",0866814935,1997
desenvolvimento rural,http://www.freipedro.pt/tb/130696/soc1.htm,https://arquivo.pt/wayback/19970620122509/http://www.freipedro.pt/tb/130696/soc1.htm,Terras da Beira - 13/06/96 - Sociedade - Já há dinheiro para mudar o mundo rural," &nbsp; &nbsp; &nbsp; &nbsp; &nbsp; J&aacute; h&aacute; dinheiro para mudar o mundo <em>rural</em> Dez associa&ccedil;&otilde;es e centros de <em>desenvolvimento</em> <em>rural</em> da<span class=""ellipsis""> ... </span> &acirc;mbito do programa de <em>desenvolvimento</em> <em>rural</em> &#147;Leader II&#148;. Na Beira Interior, para al&eacute;m da assinatura da<span class=""ellipsis""> ... </span> (PRO-RAIA), foram credenciadas a Associa&ccedil;&atilde;o de <em>Desenvolvimento</em> <em>Rural</em> da Serra da Estrela (ADRUSE<span class=""ellipsis""> ... </span>",0866809509,1997
desenvolvimento rural,http://www.utad.pt/Cursos/MestInstTecApoioDesRural/index.html,https://arquivo.pt/wayback/19971015082840/http://www.utad.pt/Cursos/MestInstTecApoioDesRural/index.html,Untitled,"Untitled Curso de Mestrado Instrumentos e T&eacute;cnicas de Apoio ao <em>Desenvolvimento</em> <em>Rural</em> O <em>desenvolvimento</em> <em>rural</em>, no seu sentido mais amplo, &eacute; hoje uma preocupa&ccedil;&atilde;o central de muitos actores e<span class=""ellipsis""> ... </span> <em>desenvolvimento</em> <em>rural</em>, como, por exemplo, as ligadas &agrave; execu&ccedil;&atilde;o do Programa LEADER. Em ambos os casos &eacute;<span class=""ellipsis""> ... </span>",0876904120,1997
desenvolvimento rural,http://www.uevora.pt/publicacoes/ofertaT/pesq/palavras_chave.htm,https://arquivo.pt/wayback/19970606033245/http://www.uevora.pt/publicacoes/ofertaT/pesq/palavras_chave.htm,," unidimensionais cont&iacute;nuo natural corti&ccedil;a cr&eacute;dito agr&iacute;cola crescimento e <em>desenvolvimento</em> sustentado damasqueiro debate pedag&oacute;gico demografia <em>desenvolvimento</em> <em>desenvolvimento</em> agr&aacute;rio <em>desenvolvimento</em> local e regional <em>desenvolvimento</em> municipal <em>desenvolvimento</em> <em>rural</em> did&aacute;tica din&acirc;mica de popula&ccedil;&otilde;es discurso pol&iacute;tico<span class=""ellipsis""> ... </span>",0865567965,1997
desenvolvimento rural,http://www.utad.pt/Cursos/MestDesenvRural/index.html,https://arquivo.pt/wayback/19971015082916/http://www.utad.pt/Cursos/MestDesenvRural/index.html,Untitled,"Untitled Mestrado em Ci&ecirc;ncias Agr&aacute;rias Instrumentos e T&eacute;cnicas de Apoio ao <em>Desenvolvimento</em> <em>Rural</em> Op&ccedil;&otilde;es em: Anima&ccedil;&atilde;o do <em>Desenvolvimento</em> <em>Rural</em> Economia <em>Rural</em> Gest&atilde;o dos Recursos Naturais Director do Curso: Prof. Doutor Artur Fernando A. C. Cristov&atilde;o Objectivo: O <em>desenvolvimento</em> <em>rural</em> no seu sentido<span class=""ellipsis""> ... </span>",0876904156,1997
desenvolvimento rural,http://www.ul.pt/~ceg/moreno1.htm,https://arquivo.pt/wayback/19970715043435/http://www.ul.pt/~ceg/moreno1.htm,Luis Moreno-Pagina Pessoal," Local (FLUL) &Aacute;reas de interesse: geografia <em>rural</em>, geografia social, <em>desenvolvimento</em> <em>rural</em><span class=""ellipsis""> ... </span> Planeamento Regional e Local), com o tema &#147;Caminhos do <em>desenvolvimento</em> local em meio <em>rural</em><span class=""ellipsis""> ... </span> investiga&ccedil;&atilde;o do CEG: - &#147;<em>Desenvolvimento</em> <em>Rural</em>: Desafio ou Utopia?&#148; - &acirc;mbito da JNICT (Prog. est&iacute;mulo em<span class=""ellipsis""> ... </span>",0868941275,1997
desenvolvimento rural,http://www.tc-portugal.pt/,https://arquivo.pt/wayback/19970116032622/http://www.tc-portugal.pt/,TCP - Telecentros Rurais de Portugal," Estruturas Agr&aacute;rias e <em>Desenvolvimento</em> <em>Rural</em> ( IEADR ) Instituto do Emprego e Forma&ccedil;&atilde;o Profissional ( IEFP<span class=""ellipsis""> ... </span> Agricultura Biol&oacute;gica ( AGROBIO ) Associa&ccedil;&atilde;o de <em>Desenvolvimento</em> <em>Rural</em> de Basto ( PROBASTO ) Associa&ccedil;&atilde;o<span class=""ellipsis""> ... </span> <em>Desenvolvimento</em> e Turismo do Norte Alentejo - ADT/NA Instrumento Financeiro para a Pol&iacute;tica Comunit&aacute;ria de<span class=""ellipsis""> ... </span>",0853385182,1997
desenvolvimento rural,http://www.tc-portugal.pt/,https://arquivo.pt/wayback/19970413045647/http://www.tc-portugal.pt/,TCP - Telecentros Rurais de Portugal," Estruturas Agr&aacute;rias e <em>Desenvolvimento</em> <em>Rural</em> ( IEADR ) Instituto do Emprego e Forma&ccedil;&atilde;o Profissional ( IEFP<span class=""ellipsis""> ... </span> Agricultura Biol&oacute;gica ( AGROBIO ) Associa&ccedil;&atilde;o de <em>Desenvolvimento</em> <em>Rural</em> de Basto ( PROBASTO ) Associa&ccedil;&atilde;o<span class=""ellipsis""> ... </span> <em>Desenvolvimento</em> e Turismo do Norte Alentejo - ADT/NA Instrumento Financeiro para a Pol&iacute;tica Comunit&aacute;ria de<span class=""ellipsis""> ... </span>",0860907407,1997
desenvolvimento rural,http://www.ul.pt/~ceg/moreno2.htm,https://arquivo.pt/wayback/19970715043747/http://www.ul.pt/~ceg/moreno2.htm,Luis Moreno-Home Page," of RC-IGU, Prague, 1994, CD-ROM) - (1994) &quot;(In)forma&ccedil;&atilde;o e <em>desenvolvimento</em> <em>rural</em> no &uacute;ltimo quarto do<span class=""ellipsis""> ... </span> (Faculty of Arts, Lisbon University) Relevant matters (keywords): <em>rural</em> geography, social geography, <em>rural</em><span class=""ellipsis""> ... </span> Planning) about &#147;Ways of local development in the <em>rural</em> context&#148;, under the supervision of Prof. Carminda<span class=""ellipsis""> ... </span>",0868941467,1997
desenvolvimento rural,http://www.uevora.pt/Estrela/Campinas/disciplinas.html,https://arquivo.pt/wayback/19970606054514/http://www.uevora.pt/Estrela/Campinas/disciplinas.html,PROJETO ALFA- ESTRELA," ENGENHARIA AGR&Iacute;COLA INFORMA&Ccedil;&Otilde;ES SOBRE AS DISCIPLINAS PARA O &quot;MASTER&quot; INTERNACIONAL EM <em>DESENVOLVIMENTO</em> <em>RURAL</em><span class=""ellipsis""> ... </span> rela&ccedil;&otilde;es com o desempenho do setor agr&iacute;cola. PROGRAMA: <em>Desenvolvimento</em> <em>rural</em> e rela&ccedil;&otilde;es com o<span class=""ellipsis""> ... </span> Assist&ecirc;ncia T&eacute;cnica e de Extens&atilde;o <em>Rural</em> no Brasil. A Extens&atilde;o <em>Rural</em> como estrat&eacute;gia de <em>desenvolvimento</em> A<span class=""ellipsis""> ... </span>",0865575914,1997
desenvolvimento rural,http://www.pcp.pt/congres/interv/0203b13.html,https://arquivo.pt/wayback/19970720081949/http://www.pcp.pt/congres/interv/0203b13.html,XV Congresso do PCP," improdutivos. &Eacute; a mesma concep&ccedil;&atilde;o de uma chamada pol&iacute;tica de <em>desenvolvimento</em> <em>rural</em> dissociada da<span class=""ellipsis""> ... </span>; desertifica&ccedil;&atilde;o do Interior e do Alentejo; decl&iacute;nio do Mundo <em>Rural</em>. A quest&atilde;o, hoje, n&atilde;o &eacute; de<span class=""ellipsis""> ... </span> e sal&aacute;rios dignos dos trabalhadores agr&iacute;colas, <em>desenvolvimento</em> da produ&ccedil;&atilde;o e de n&iacute;veis adequados de<span class=""ellipsis""> ... </span>",0869386789,1997
desenvolvimento rural,http://www.pcp.pt/partido/anos/congres/interv/0203b13.html,https://arquivo.pt/wayback/19971024150426/http://www.pcp.pt/partido/anos/congres/interv/0203b13.html,XV Congresso do PCP," improdutivos. &Eacute; a mesma concep&ccedil;&atilde;o de uma chamada pol&iacute;tica de <em>desenvolvimento</em> <em>rural</em> dissociada da<span class=""ellipsis""> ... </span>; desertifica&ccedil;&atilde;o do Interior e do Alentejo; decl&iacute;nio do Mundo <em>Rural</em>. A quest&atilde;o, hoje, n&atilde;o &eacute; de<span class=""ellipsis""> ... </span> e sal&aacute;rios dignos dos trabalhadores agr&iacute;colas, <em>desenvolvimento</em> da produ&ccedil;&atilde;o e de n&iacute;veis adequados de<span class=""ellipsis""> ... </span>",0877705466,1997
desenvolvimento rural,http://www.lusodoc.pt/produtos/SP/T7053.htm,https://arquivo.pt/wayback/19971007090816/http://www.lusodoc.pt/produtos/SP/T7053.htm,," gest&atilde;o ambiental nas regi&otilde;es tropicais e sub-tropicais desde 1975 at&eacute; ao presente. A <em>RURAL</em> abrange os aspectos s&oacute;cio-econ&oacute;micos do <em>desenvolvimento</em> <em>rural</em> nos paises em <em>desenvolvimento</em>. Pode ser usada<span class=""ellipsis""> ... </span>Lusodoc - Produtos - TROPAG &amp; <em>RURAL</em> TROPAG &amp; <em>RURAL</em> Editada pelo Royal Tropical Institute of<span class=""ellipsis""> ... </span>",0876215296,1997
desenvolvimento rural,http://demo4.local.lusodoc.pt/produtos/SP/T7053.htm,https://arquivo.pt/wayback/19970407073250/http://demo4.local.lusodoc.pt/produtos/SP/T7053.htm,," gest&atilde;o ambiental nas regi&otilde;es tropicais e sub-tropicais desde 1975 at&eacute; ao presente. A <em>RURAL</em> abrange os aspectos s&oacute;cio-econ&oacute;micos do <em>desenvolvimento</em> <em>rural</em> nos paises em <em>desenvolvimento</em>. Pode ser usada<span class=""ellipsis""> ... </span>Lusodoc - Produtos - TROPAG &amp; <em>RURAL</em> TROPAG &amp; <em>RURAL</em> Editada pelo Royal Tropical Institute of<span class=""ellipsis""> ... </span>",0860398370,1997
desenvolvimento rural,http://demo4.local.lusodoc.pt/produtos/SP/T7053.htm,https://arquivo.pt/wayback/19970723191239/http://demo4.local.lusodoc.pt/produtos/SP/T7053.htm,," gest&atilde;o ambiental nas regi&otilde;es tropicais e sub-tropicais desde 1975 at&eacute; ao presente. A <em>RURAL</em> abrange os aspectos s&oacute;cio-econ&oacute;micos do <em>desenvolvimento</em> <em>rural</em> nos paises em <em>desenvolvimento</em>. Pode ser usada<span class=""ellipsis""> ... </span>Lusodoc - Produtos - TROPAG &amp; <em>RURAL</em> TROPAG &amp; <em>RURAL</em> Editada pelo Royal Tropical Institute of<span class=""ellipsis""> ... </span>",0869685159,1997
desenvolvimento rural,http://www.inforg.pt/100maiores/p19.html,https://arquivo.pt/wayback/19970130092009/http://www.inforg.pt/100maiores/p19.html,100 Maiores Empresas do Distrito de Leiria," acessos das explora&ccedil;&otilde;es at&eacute; aos mercados. O projecto de <em>desenvolvimento</em> <em>rural</em> de Alvorninha, no<span class=""ellipsis""> ... </span>; Deputado do PS/Leiria &Eacute; j&aacute; um lugar comum dizer que o <em>desenvolvimento</em> econ&oacute;mico e social do Distrito de<span class=""ellipsis""> ... </span>, nomeadamente a aus&ecirc;ncia de estrat&eacute;gia de <em>desenvolvimento</em> regional com suficiente protagonismo nacional, o<span class=""ellipsis""> ... </span>",0854616009,1997
desenvolvimento rural,http://www.inforg.pt/100maiores/p19.html,https://arquivo.pt/wayback/19970523072340/http://www.inforg.pt/100maiores/p19.html,100 Maiores Empresas do Distrito de Leiria," acessos das explora&ccedil;&otilde;es at&eacute; aos mercados. O projecto de <em>desenvolvimento</em> <em>rural</em> de Alvorninha, no<span class=""ellipsis""> ... </span>; Deputado do PS/Leiria &Eacute; j&aacute; um lugar comum dizer que o <em>desenvolvimento</em> econ&oacute;mico e social do Distrito de<span class=""ellipsis""> ... </span>, nomeadamente a aus&ecirc;ncia de estrat&eacute;gia de <em>desenvolvimento</em> regional com suficiente protagonismo nacional, o<span class=""ellipsis""> ... </span>",0864372220,1997
desenvolvimento rural,http://www.lusa.pt/impreg/impreg/16ABR97/not0302.html,https://arquivo.pt/wayback/19970716224026/http://www.lusa.pt/impreg/impreg/16ABR97/not0302.html,Notícia 0302,"Not&iacute;cia 0302 &nbsp; 16 ABR 97 - 15:39 Mundo <em>rural</em>: 600 mil contos para <em>desenvolvimento</em> no Norte do Alentejo Lisboa, 16 Abr (Lusa) - A Associa&ccedil;&atilde;o de <em>Desenvolvimento</em> em Espa&ccedil;o <em>Rural</em> do Norte do Alentejo<span class=""ellipsis""> ... </span>-feira dia 17 em Portalegre entre a Direc&ccedil;&atilde;o Geral de <em>Desenvolvimento</em> <em>Rural</em> e a ADER-AL, no quadro do<span class=""ellipsis""> ... </span>",0869092826,1997
desenvolvimento rural,http://wolf.telepac.pt/add/apr8prt.htm,https://arquivo.pt/wayback/19970803042058/http://wolf.telepac.pt/add/apr8prt.htm,A.D.D.," Economia <em>Rural</em>, podendo auxiliar a execu&ccedil;&atilde;o de projectos nas seguintes &Aacute;reas: Apoio T&eacute;cnico ao <em>Desenvolvimento</em> <em>Rural</em> : -- Actividades S&oacute;cio-Culturais; -- Assist&ecirc;ncia T&eacute;cnica; -- Promo&ccedil;&atilde;o de Informa&ccedil;&atilde;o<span class=""ellipsis""> ... </span> &agrave; Contrata&ccedil;&atilde;o : -- Forma&ccedil;&atilde;o Integrada para o <em>Desenvolvimento</em> <em>Rural</em>; -- Aquisi&ccedil;&atilde;o de Compet&ecirc;ncias<span class=""ellipsis""> ... </span>",0870582058,1997
desenvolvimento rural,http://wolf.telepac.pt/add/apr8prt.htm,https://arquivo.pt/wayback/19970511135320/http://wolf.telepac.pt/add/apr8prt.htm,A.D.D.," Economia <em>Rural</em>, podendo auxiliar a execu&ccedil;&atilde;o de projectos nas seguintes &Aacute;reas: Apoio T&eacute;cnico ao <em>Desenvolvimento</em> <em>Rural</em> : -- Actividades S&oacute;cio-Culturais; -- Assist&ecirc;ncia T&eacute;cnica; -- Promo&ccedil;&atilde;o de Informa&ccedil;&atilde;o<span class=""ellipsis""> ... </span> &agrave; Contrata&ccedil;&atilde;o : -- Forma&ccedil;&atilde;o Integrada para o <em>Desenvolvimento</em> <em>Rural</em>; -- Aquisi&ccedil;&atilde;o de Compet&ecirc;ncias<span class=""ellipsis""> ... </span>",0863358800,1997
desenvolvimento rural,http://www.min-qemp.pt/acordo/indice.html,https://arquivo.pt/wayback/19970203203357/http://www.min-qemp.pt/acordo/indice.html,MQE : Acordo de Concertação Estratégica - Índice," - Agricultura, F lorestas , <em>Desenvolvimento</em> <em>Rural</em> e Pescas 12 &nbsp; &nbsp; 1. Pol&iacute;tica agr&iacute;cola, florestal e de <em>desenvolvimento</em> <em>rural</em> 13 &nbsp; &nbsp; 2. Pol&iacute;tica de pescas 15 &nbsp; IV - AMBIENTE 16 &nbsp; V - POL&Iacute;TICA DE<span class=""ellipsis""> ... </span>, DO <em>DESENVOLVIMENTO</em> <em>RURAL</em> E DAS PESCAS 65 &nbsp; &nbsp; 1. Medidas legislativas e regulamentares de car&aacute;cter<span class=""ellipsis""> ... </span>",0855002037,1997
desenvolvimento rural,http://www.min-qemp.pt/acordo/indice.html,https://arquivo.pt/wayback/19970714024105/http://www.min-qemp.pt/acordo/indice.html,MQE : Acordo de Concertação Estratégica - Índice," 8 &nbsp; III - Agricultura, F lorestas , <em>Desenvolvimento</em> <em>Rural</em> e Pescas 1 9 &nbsp; &nbsp; 1. Pol&iacute;tica agr&iacute;cola, florestal e de <em>desenvolvimento</em> <em>rural</em> 20 &nbsp; &nbsp; 2. Pol&iacute;tica de pescas 22 &nbsp; IV - AMBIENTE 24 &nbsp; V - POL&Iacute;TICA<span class=""ellipsis""> ... </span> POL&Iacute;TICA AGR&Iacute;COLA, FLORESTAS, DO <em>DESENVOLVIMENTO</em> <em>RURAL</em> E DAS PESCAS 83 &nbsp; &nbsp; 1. Medidas legislativas e<span class=""ellipsis""> ... </span>",0868848065,1997
desenvolvimento rural,http://sdum.ci.uminho.pt/cdeum/c3.html,https://arquivo.pt/wayback/19971023092711/http://sdum.ci.uminho.pt/cdeum/c3.html,," <em>DESENVOLVIMENTO</em> DA ECONOMIA <em>RURAL</em> Entidades a contactar A n&iacute;vel comunit&aacute;rio Comiss&atilde;o Europeia Direc&ccedil;&atilde;o Geral VI-Agricultura Direc&ccedil;&atilde;o F.I/1-<em>Desenvolvimento</em> <em>rural</em> I Michael Laine Rue de la Loi, 200 B-1049 Bruxelas<span class=""ellipsis""> ... </span> <em>Desenvolvimento</em> <em>Rural</em> (IEADR) Avenida Afonso Costa, 3 1 900 Lisboa Tel: (01) 847 01 60 Fax: (01) 847<span class=""ellipsis""> ... </span>",0877598831,1997
desenvolvimento rural,http://cde.ci.uminho.pt/c3.html,https://arquivo.pt/wayback/19970204120139/http://cde.ci.uminho.pt/c3.html,," <em>DESENVOLVIMENTO</em> DA ECONOMIA <em>RURAL</em> Entidades a contactar A n&iacute;vel comunit&aacute;rio Comiss&atilde;o Europeia Direc&ccedil;&atilde;o Geral VI-Agricultura Direc&ccedil;&atilde;o F.I/1-<em>Desenvolvimento</em> <em>rural</em> I Michael Laine Rue de la Loi, 200 B-1049 Bruxelas<span class=""ellipsis""> ... </span> <em>Desenvolvimento</em> <em>Rural</em> (IEADR) Avenida Afonso Costa, 3 1 900 Lisboa Tel: (01) 847 01 60 Fax: (01) 847<span class=""ellipsis""> ... </span>",0855057699,1997
