query,original_url,archive_url,title,snippet,archive_date,year
desenvolvimento rural,http://www.uni.pt/cursos/economia.htm,https://arquivo.pt/wayback/19970213000249/http://www.uni.pt/cursos/economia.htm,Plano Curricular do Curso de Economia,"(s2) -- -- 3 Economia e Pol&iacute;tica Social Semestral(s2) -- -- 3 <em>Desenvolvimento</em> <em>Rural</em> e Urbano Semestral(s2) -- -- 3 <em>Desenvolvimento</em> Regional Semestral(s2) -- -- 3 M&eacute;todo de Precis&atilde;o e Optimiza&ccedil;&atilde;o<span class=""ellipsis""> ... </span> 2 -- 2 <em>Desenvolvimento</em> Econ&oacute;mico Anual -- -- 3 direito Comunit&aacute;rio Anual -- -- 3 Economia<span class=""ellipsis""> ... </span>",0855792169,1997
desenvolvimento rural,http://www.min-plan.pt/menu/docum/despachos/combo-2.htm,https://arquivo.pt/wayback/19970601162135/http://www.min-plan.pt/menu/docum/despachos/combo-2.htm,DESPACHO Nº 135 /96," <em>Desenvolvimento</em> <em>Rural</em> e Pescas - Minist&eacute;rio do Ambiente - Minist&eacute;rio da Ci&ecirc;ncia e Tecnologia. - Junta<span class=""ellipsis""> ... </span> cient&iacute;fica &eacute; essencial para o <em>desenvolvimento</em> do Pa&iacute;s. N&atilde;o h&aacute; progresso material, como n&atilde;o h&aacute; progresso<span class=""ellipsis""> ... </span> no nosso pa&iacute;s. O Governo entende mais uma vez afirmar que o <em>desenvolvimento</em> cient&iacute;fico e<span class=""ellipsis""> ... </span>",0865182095,1997
desenvolvimento rural,http://www.uni.pt/cursos/economia.htm,https://arquivo.pt/wayback/19970730053110/http://www.uni.pt/cursos/economia.htm,Plano Curricular do Curso de Economia,"(s2) -- -- 3 Economia e Pol&iacute;tica Social Semestral(s2) -- -- 3 <em>Desenvolvimento</em> <em>Rural</em> e Urbano Semestral(s2) -- -- 3 <em>Desenvolvimento</em> Regional Semestral(s2) -- -- 3 M&eacute;todo de Precis&atilde;o e Optimiza&ccedil;&atilde;o<span class=""ellipsis""> ... </span> 2 -- 2 <em>Desenvolvimento</em> Econ&oacute;mico Anual -- -- 3 direito Comunit&aacute;rio Anual -- -- 3 Economia<span class=""ellipsis""> ... </span>",0870240670,1997
desenvolvimento rural,http://www.inia.pt/ini2.HTM,https://arquivo.pt/wayback/19971023182542/http://www.inia.pt/ini2.HTM,INIA - Home Page," 3977086 O INIA &eacute; o organismo do Minist&eacute;rio da Agricultura, do <em>Desenvolvimento</em> <em>Rural</em> e das Pescas<span class=""ellipsis""> ... </span> necess&aacute;rias ao <em>desenvolvimento</em> das fileiras produtivas agr&iacute;colas, pecu&aacute;ria e florestal&amp;quot (Lei org&acirc;nica do<span class=""ellipsis""> ... </span> pol&iacute;ticas de <em>desenvolvimento</em> agr&aacute;rio que o MADRP suporta. Tamb&eacute;m promove apoia e assegura a<span class=""ellipsis""> ... </span>",0877631142,1997
desenvolvimento rural,http://ermelo.utad.pt/descobrir/ensino.html,https://arquivo.pt/wayback/19971224152645/http://ermelo.utad.pt/descobrir/ensino.html,Ensino," T&eacute;cnicas de Apoio ao <em>Desenvolvimento</em> Agricultura, Ambiente e Mercados Engenharia da Produ&ccedil;&atilde;o Florestal Engenharia dos Recursos Florestais Extens&atilde;o e <em>Desenvolvimento</em> <em>Rural</em> Horticultura, Fruticultura e<span class=""ellipsis""> ... </span> ursos de E studos S uperiores E specializados Educa&ccedil;&atilde;o de Adultos e <em>Desenvolvimento</em> Comunit&aacute;rio em<span class=""ellipsis""> ... </span>",0882977205,1997
desenvolvimento rural,http://belisama.jnict.pt/4prog.htm,https://arquivo.pt/wayback/19970131101507/http://belisama.jnict.pt/4prog.htm,4º Programa Quadro," alimentares, a silvicultura, a aquicultura e o <em>desenvolvimento</em> <em>rural</em>) - Garantir a competitividade, a efic&aacute;cia<span class=""ellipsis""> ... </span> servi&ccedil;os de interesse p&uacute;blico e estimular a cria&ccedil;&atilde;o de empregos atrav&eacute;s do <em>desenvolvimento</em> de novos<span class=""ellipsis""> ... </span> comunica&ccedil;&atilde;o por forma a constituir um apoio essencial para o <em>desenvolvimento</em> de redes e servi&ccedil;os<span class=""ellipsis""> ... </span>",0854705707,1997
desenvolvimento rural,http://www.fe.up.pt/aefewww/deq93/pi/fapas/queixa.html,https://arquivo.pt/wayback/19970803130209/http://www.fe.up.pt/aefewww/deq93/pi/fapas/queixa.html,Queixa à Comissão da União Europeia," Portugal, atrav&eacute;s do Instituto de Estruturas Agr&aacute;rias e <em>Desenvolvimento</em> <em>Rural</em> (IEADR), pretende<span class=""ellipsis""> ... </span> tugal e em toda a Europa. Pretende o Estado Portugu&ecirc;s, com o Plano de <em>Desenvolvimento</em> Agr&iacute;cola do Baixo<span class=""ellipsis""> ... </span> ecol&oacute;gico da &aacute;rea. O primeiro passo deste Projecto de <em>Desenvolvimento</em> Agr&iacute;cola &eacute; a constru&ccedil;&atilde;o de parte do<span class=""ellipsis""> ... </span>",0870613329,1997
desenvolvimento rural,http://www.fe.uc.pt/feuc/publica/sumar_rc.htm,https://arquivo.pt/wayback/19970719035347/http://www.fe.uc.pt/feuc/publica/sumar_rc.htm,sumários rccs/preço," ; Carlos Lencastre da Costa, <em>Desenvolvimento</em> <em>rural</em> integrado - uma estrat&eacute;gia para a pequena agricultura<span class=""ellipsis""> ... </span> Resultados; Maurice Zeitlin, Hegemonia Pol&iacute;tica na Classe Dominante, no Estado e no <em>Desenvolvimento</em><span class=""ellipsis""> ... </span> Elei&ccedil;&otilde;es de 1978 no Brasil ; Afonso de Barros, A Reforma Agr&aacute;ria em Portugal e o <em>Desenvolvimento</em><span class=""ellipsis""> ... </span>",0869284427,1997
desenvolvimento rural,http://snig.cnig.pt/snig/nacional.html,https://arquivo.pt/wayback/19970210112756/http://snig.cnig.pt/snig/nacional.html,SNIG - Entidades Aderentes - Âmbito Nacional," <em>Desenvolvimento</em> <em>Rural</em> IGeoE - Instituto Geogr&aacute;fico do Ex&eacute;rcito IGM - Instituto Geol&oacute;gico Mineiro IH - Instituto<span class=""ellipsis""> ... </span> - Direc&ccedil;&atilde;o Geral das Florestas DGOTDU - Direc&ccedil;&atilde;o Geral do Ordenamento do Territ&oacute;rio e <em>Desenvolvimento</em><span class=""ellipsis""> ... </span>",0855574076,1997
desenvolvimento rural,http://www.iefp.pt/cfp/coimbra/coimbra.html,https://arquivo.pt/wayback/19970713223201/http://www.iefp.pt/cfp/coimbra/coimbra.html,Coimbra," Financeiros, Inform&aacute;tica e, ainda, Agricultura e <em>Desenvolvimento</em> <em>Rural</em>. Para a forma&ccedil;&atilde;o profissional nesta<span class=""ellipsis""> ... </span> na satisfa&ccedil;&atilde;o das solicita&ccedil;&otilde;es do mercado de emprego, assim como na dinamiza&ccedil;&atilde;o do <em>desenvolvimento</em> da<span class=""ellipsis""> ... </span>",0868833121,1997
desenvolvimento rural,http://www.cnc.pt/pages/entpubpriv.html,https://arquivo.pt/wayback/19971110033055/http://www.cnc.pt/pages/entpubpriv.html,Entidades Públicas e Privadas," Estruturas Agr&aacute;rias e <em>Desenvolvimento</em> <em>Rural</em> Instituto Nacional de Estat&iacute;stica JNICT - Junta Nacional de<span class=""ellipsis""> ... </span> Ci&ecirc;ncia e Tecnologia Presid&ecirc;ncia do Conselho de Ministros PRODEP - Programa de <em>Desenvolvimento</em><span class=""ellipsis""> ... </span>",0879132655,1997
desenvolvimento rural,http://www.imagine.pt/me/tm/fax09.htm,https://arquivo.pt/wayback/19970724182002/http://www.imagine.pt/me/tm/fax09.htm,A EUROPA AO P.É. DE SI," Comiss&atilde;o de Agricultura e <em>Desenvolvimento</em> <em>Rural</em>, no sentido de levar a Comiss&atilde;o a cumprir o seu<span class=""ellipsis""> ... </span> <em>desenvolvimento</em>, os transportes e o ambiente. - Defini&ccedil;&atilde;o duma pol&iacute;tica exterior e de seguran&ccedil;a comuns<span class=""ellipsis""> ... </span>",0869768402,1997
desenvolvimento rural,http://www.acap.pt/inf_vit/00000007.htm,https://arquivo.pt/wayback/19970201174018/http://www.acap.pt/inf_vit/00000007.htm,Cooperação Institucional da ACAP," e M&eacute;dias Empresas e ao Investimento); - IEADR (Instituto de Estruturas Agr&aacute;rias e <em>Desenvolvimento</em> <em>Rural</em>), - IDICT (Instituto de <em>Desenvolvimento</em> e Inspec&ccedil;&atilde;o das Condi&ccedil;&otilde;es de Trabalho); - CECOA (Centro<span class=""ellipsis""> ... </span>",0854818818,1997
desenvolvimento rural,http://www.espaco-publico.pt/correio.vouga/arquivo/26_2_97c.html,https://arquivo.pt/wayback/19970501030501/http://www.espaco-publico.pt/correio.vouga/arquivo/26_2_97c.html,Arquivo - Correio do Vouga," Centro, do Instituto de Estruturas Agr&aacute;rias e <em>Desenvolvimento</em> <em>Rural</em> - Baixo Vouga e do Instituto de<span class=""ellipsis""> ... </span> no programa Life 96 - Ambiente, criado para <em>desenvolvimento</em> da pol&iacute;tica ambiental comunit&aacute;ria e<span class=""ellipsis""> ... </span>",0862455901,1997
desenvolvimento rural,http://www.iefp.pt/cfp/faro/faro.html,https://arquivo.pt/wayback/19970713224408/http://www.iefp.pt/cfp/faro/faro.html,Faro," Centro est&aacute;, presentemente, vocacionado para as &aacute;reas de Agricultura e <em>Desenvolvimento</em> <em>Rural</em>; Constru&ccedil;&atilde;o<span class=""ellipsis""> ... </span> emprego, assim como na dinamiza&ccedil;&atilde;o do <em>desenvolvimento</em> da regi&atilde;o em que se insere. Endere&ccedil;o: FARO Rua<span class=""ellipsis""> ... </span>",0868833848,1997
desenvolvimento rural,http://www.imagine.pt/me/tm/fax09.htm,https://arquivo.pt/wayback/19970207185133/http://www.imagine.pt/me/tm/fax09.htm,A EUROPA AO P.É. DE SI," Comiss&atilde;o de Agricultura e <em>Desenvolvimento</em> <em>Rural</em>, no sentido de levar a Comiss&atilde;o a cumprir o seu<span class=""ellipsis""> ... </span> <em>desenvolvimento</em>, os transportes e o ambiente. - Defini&ccedil;&atilde;o duma pol&iacute;tica exterior e de seguran&ccedil;a comuns<span class=""ellipsis""> ... </span>",0855341493,1997
desenvolvimento rural,http://www.cnc.pt/pages/entpubpriv.html,https://arquivo.pt/wayback/19970719051750/http://www.cnc.pt/pages/entpubpriv.html,Entidades Públicas e Privadas," Estruturas Agr&aacute;rias e <em>Desenvolvimento</em> <em>Rural</em> Instituto Nacional de Estat&iacute;stica JNICT - Junta Nacional de<span class=""ellipsis""> ... </span> Ci&ecirc;ncia e Tecnologia Presid&ecirc;ncia do Conselho de Ministros PRODEP - Programa de <em>Desenvolvimento</em><span class=""ellipsis""> ... </span>",0869289470,1997
desenvolvimento rural,http://home.utad.pt/descobrir/ensino.html,https://arquivo.pt/wayback/19970415044110/http://home.utad.pt/descobrir/ensino.html,Ensino," Produ&ccedil;&atilde;o Florestal Engenharia dos Recursos Florestais Extens&atilde;o e <em>Desenvolvimento</em> <em>Rural</em> Horticultura<span class=""ellipsis""> ... </span> para a Sa&uacute;de C ursos de E studos S uperiores E specializados Educa&ccedil;&atilde;o de Adultos e <em>Desenvolvimento</em><span class=""ellipsis""> ... </span>",0861079270,1997
desenvolvimento rural,http://www.iscac.pt/pt.htm,https://arquivo.pt/wayback/19971007162301/http://www.iscac.pt/pt.htm,Domínios PT," Informatica Direccao Geral de <em>Desenvolvimento</em> <em>Rural</em> Direccao Geral de Viacao Direccao Geral do<span class=""ellipsis""> ... </span> Agrarias e <em>Desenvolvimento</em> <em>Rural</em> Instituto de Formacao e Investigacao da Lingua Portuguesa Instituto de<span class=""ellipsis""> ... </span> Minimal - Formacao e Consultadoria, Lda Ministerio da Agricultura, do <em>Desenvolvimento</em> <em>Rural</em> e das<span class=""ellipsis""> ... </span>",0876241381,1997
desenvolvimento rural,http://ecclesia.pt/13novembro/interna.htm,https://arquivo.pt/wayback/19970223110313/http://ecclesia.pt/13novembro/interna.htm,Agência Ecclesia - Internacional," <em>desenvolvimento</em> dos povos&quot;. Perante tais situa&ccedil;&otilde;es, os leigos s&atilde;o chamados a enriquecer os valores humanos e<span class=""ellipsis""> ... </span>, arcebispo Renato Martino, numa Confer&ecirc;ncia sobre as actividades para o <em>desenvolvimento</em>. O prelado<span class=""ellipsis""> ... </span> favor do <em>desenvolvimento</em> humano e daluta contra a pobreza. A Santa S&eacute;, pela sua parte, oferece os seus<span class=""ellipsis""> ... </span>",0856695793,1997
desenvolvimento rural,http://www.cidadevirtual.pt/cidade.virtual/dir/nee/index.html,https://arquivo.pt/wayback/19970414095706/http://www.cidadevirtual.pt/cidade.virtual/dir/nee/index.html,Cidade Virtual - Negócios e Empresas,", <em>desenvolvimento</em> de aplica&ccedil;&otilde;es Web, cursos de forma&ccedil;&atilde;o, semin&aacute;rios Internet, etc. Banco It&aacute;u Europa<span class=""ellipsis""> ... </span> Inform&aacute;ticas Lda &eacute; uma &quot;software house&quot; dedicada ao <em>desenvolvimento</em> de aplica&ccedil;&otilde;es de gest&atilde;o para o<span class=""ellipsis""> ... </span>, Tele-Servi&ccedil;os, Tele-Educa&ccedil;&atilde;o (forma&ccedil;&atilde;o aberta a dist&acirc;ncia e de base tecnol&oacute;gica) e <em>desenvolvimento</em><span class=""ellipsis""> ... </span>",0861011826,1997
desenvolvimento rural,http://voz-portucalense.pt/21novembro/mundo.htm,https://arquivo.pt/wayback/19971022131559/http://voz-portucalense.pt/21novembro/mundo.htm,Voz Portucalense - Mundo," ao Fundo das Na&ccedil;&otilde;es Unidas para o <em>Desenvolvimento</em>, com o fim de ser aplicado num projecto de <em>desenvolvimento</em> <em>rural</em>. O Fundo para pessoas deficientes receber&aacute; dois mil d&oacute;lares destinando-se outros mil<span class=""ellipsis""> ... </span> da ONU. NO entanto, a Igreja dar&aacute; o maior apoio a projectos em favor do <em>desenvolvimento</em> humano e da<span class=""ellipsis""> ... </span>",0877526159,1997
desenvolvimento rural,http://voz-portucalense.pt/21novembro/mundo.htm,https://arquivo.pt/wayback/19970714095957/http://voz-portucalense.pt/21novembro/mundo.htm,Voz Portucalense - Mundo," ao Fundo das Na&ccedil;&otilde;es Unidas para o <em>Desenvolvimento</em>, com o fim de ser aplicado num projecto de <em>desenvolvimento</em> <em>rural</em>. O Fundo para pessoas deficientes receber&aacute; dois mil d&oacute;lares destinando-se outros mil<span class=""ellipsis""> ... </span> da ONU. NO entanto, a Igreja dar&aacute; o maior apoio a projectos em favor do <em>desenvolvimento</em> humano e da<span class=""ellipsis""> ... </span>",0868874397,1997
desenvolvimento rural,http://www.apotec.pt/sjunho.txt,https://arquivo.pt/wayback/19971121031623/http://www.apotec.pt/sjunho.txt,," <em>Desenvolvimento</em> <em>Rural</em> e das Pescas.
Mais se mandatam outros Ministros para implementar medidas com vista &agrave;<span class=""ellipsis""> ... </span>)	<em>Desenvolvimento</em> do mercado de capitais e ampla participa&ccedil;&atilde;o dos cidad&atilde;os;
c)	Redu&ccedil;&atilde;o do peso do Estado e da<span class=""ellipsis""> ... </span> considerados absolutamente relevantes para a pr&oacute;pria empresa, em fun&ccedil;&atilde;o de estrat&eacute;gias de <em>desenvolvimento</em><span class=""ellipsis""> ... </span>",0880082183,1997
desenvolvimento rural,http://ci.ist.utl.pt/ist/servs/org.html,https://arquivo.pt/wayback/19970301052642/http://ci.ist.utl.pt/ist/servs/org.html,Organismos Estatais:,"Organismos Estatais: Minist&eacute;rio da Educa&ccedil;&atilde;o Minist&eacute;rio da Ci&ecirc;ncia e Tecnologia INFOCID-Informa&ccedil;&atilde;o ao Cidad&atilde;o Direc&ccedil;&atilde;o Geral do Ambiente CTT-Correios de Portugal DEMQE-Dep.Estat&iacute;stica, Min. para a Qualifica&ccedil;&atilde;o e Emprego IEADR-Instituto de Estruturas Agr&aacute;rias e <em>Desenvolvimento</em> <em>Rural</em> INAG-Instituto da<span class=""ellipsis""> ... </span>",0857194002,1997
desenvolvimento rural,http://www.parlamento.pt/vii/comiss/adrp/index.html,https://arquivo.pt/wayback/19970607011812/http://www.parlamento.pt/vii/comiss/adrp/index.html,Comissão ADRP,"Comiss&atilde;o ADRP Comiss&atilde;o de Agricultura, <em>Desenvolvimento</em> <em>Rural</em> e Pescas Composi&ccedil;&atilde;o da Comiss&atilde;o Listagem Alfab&eacute;tica dos Deputados que Integram a Comiss&atilde;o Subcomiss&otilde;es [ Conhecer o Parlamento ] [ A Semana Parlamentar: Boletim ] [ Os Deputados ] [ As Reuni&otilde;es Plen&aacute;rias ] [ As Comiss&otilde;es Parlamentares<span class=""ellipsis""> ... </span>",0865646292,1997
desenvolvimento rural,http://www.parlamento.pt/vii/comiss/adrp/subcom/pescas/compo.html,https://arquivo.pt/wayback/19970607024956/http://www.parlamento.pt/vii/comiss/adrp/subcom/pescas/compo.html,Subcomissão Pescas,"Subcomiss&atilde;o Pescas Comiss&atilde;o de Agricultura, <em>Desenvolvimento</em> <em>Rural</em> e Pescas Subcomiss&atilde;o Permanente - Pescas Grupo Parlamentar N&uacute;mero de Lugares Grupo Parlamentar do Partido Socialista 3 Grupo Parlamentar do Partido Social Democrata 2 Grupo Parlamentar do Partido Popular 1 Grupo Parlamentar do<span class=""ellipsis""> ... </span>",0865651796,1997
desenvolvimento rural,http://www.ist.utl.pt/ist/servs/org.html,https://arquivo.pt/wayback/19971012090221/http://www.ist.utl.pt/ist/servs/org.html,Organismos Estatais:,"Organismos Estatais: Minist&eacute;rio da Educa&ccedil;&atilde;o Minist&eacute;rio da Ci&ecirc;ncia e Tecnologia INFOCID-Informa&ccedil;&atilde;o ao Cidad&atilde;o Direc&ccedil;&atilde;o Geral do Ambiente CTT-Correios de Portugal DEMQE-Dep.Estat&iacute;stica, Min. para a Qualifica&ccedil;&atilde;o e Emprego IEADR-Instituto de Estruturas Agr&aacute;rias e <em>Desenvolvimento</em> <em>Rural</em> INAG-Instituto da<span class=""ellipsis""> ... </span>",0876646941,1997
desenvolvimento rural,http://darwin.icn.pt/parques/pnse.html,https://arquivo.pt/wayback/19971224180705/http://darwin.icn.pt/parques/pnse.html,Parque Natural da Serra da Estrela," aspectos geol&oacute;gicos e das esp&eacute;cies da flora e fauna que caracterizam o Parque Natural. <em>Desenvolvimento</em> <em>rural</em> atrav&eacute;s da vitaliza&ccedil;&atilde;o das actividades econ&oacute;micas tradicionais. Salvaguarda do patrim&oacute;nio<span class=""ellipsis""> ... </span>",0882986825,1997
desenvolvimento rural,http://belisama.jnict.pt/fair.htm,https://arquivo.pt/wayback/19970131102000/http://belisama.jnict.pt/fair.htm,FAIR," e <em>desenvolvimento</em> <em>rural</em>; Pescas e Aquacultura. Objectivos a atingir por concerta&ccedil;&atilde;o O prazo limite<span class=""ellipsis""> ... </span>",0854706000,1997
desenvolvimento rural,http://ci.ist.utl.pt:81/ist/servs/org.html,https://arquivo.pt/wayback/19970204220212/http://ci.ist.utl.pt:81/ist/servs/org.html,Organismos Estatais:,"Organismos Estatais: Minist&eacute;rio da Educa&ccedil;&atilde;o Minist&eacute;rio da Ci&ecirc;ncia e Tecnologia INFOCID-Informa&ccedil;&atilde;o ao Cidad&atilde;o Direc&ccedil;&atilde;o Geral do Ambiente CTT-Correios de Portugal DEMQE-Dep.Estat&iacute;stica, Min. para a Qualifica&ccedil;&atilde;o e Emprego IEADR-Instituto de Estruturas Agr&aacute;rias e <em>Desenvolvimento</em> <em>Rural</em> INAG-Instituto da<span class=""ellipsis""> ... </span>",0855093732,1997
desenvolvimento rural,http://www.isa.utl.pt/campus/olhar.html,https://arquivo.pt/wayback/19970428045434/http://www.isa.utl.pt/campus/olhar.html,CampUs: Olhar," Estruturas Agr&aacute;rias e <em>Desenvolvimento</em> <em>Rural</em> , o Laborat&oacute;rio Nacional de Engenharia Civil , o<span class=""ellipsis""> ... </span>",0862203274,1997
desenvolvimento rural,http://www.esb.ucp.pt/biblio/fi-inf/maio.htm,https://arquivo.pt/wayback/19971012095452/http://www.esb.ucp.pt/biblio/fi-inf/maio.htm,,": gest&atilde;o de recursos &nbsp; Economia <em>rural</em>: <em>desenvolvimento</em> &nbsp; Organizados por: CIHEAM (Centre<span class=""ellipsis""> ... </span>",0876650092,1997
desenvolvimento rural,http://www.primeiro-ministro.gov.pt/g-ligacoes.htm,https://arquivo.pt/wayback/19970404004028/http://www.primeiro-ministro.gov.pt/g-ligacoes.htm,OutasPaginasGoverno,"OutasPaginasGoverno &nbsp; Governo Liga&ccedil;&otilde;es a Outras P&aacute;ginas Presid&ecirc;ncia do Conselho de Ministros Minist&eacute;rio da Defesa Nacional Minist&eacute;rio dos Neg&oacute;cios Estrangeiros Minist&eacute;rio do Equipamento, do Planeamento e da Administra&ccedil;&atilde;o do Territ&oacute;rio Minist&eacute;rio da Agricultura, do <em>Desenvolvimento</em> <em>Rural</em> e das Pescas<span class=""ellipsis""> ... </span>",0860114428,1997
desenvolvimento rural,http://www.centroatl.pt/netnews/nn_ano1/edicao01/nn1_acor.html,https://arquivo.pt/wayback/19970525141518/http://www.centroatl.pt/netnews/nn_ano1/edicao01/nn1_acor.html,net.News Nº1 de 30 de Abril de 1996 - A Internet nos Açores," l&iacute;quidos reverter&atilde;o totalmente para o apoio de outras iniciativas de economia solid&aacute;ria e <em>desenvolvimento</em> <em>rural</em>. Com a abertura deste quiosque s&atilde;o j&aacute; dois os existentes nos A&ccedil;ores. Um em Ponta Delgada<span class=""ellipsis""> ... </span>",0864569718,1997
desenvolvimento rural,http://netizens.hpv.pt/rnatario/estatistica.htm,https://arquivo.pt/wayback/19970714102801/http://netizens.hpv.pt/rnatario/estatistica.htm,Navegar na Floresta - Estatística," - Minist&eacute;rio da Agricultura, do <em>Desenvolvimento</em> <em>Rural</em> e das Pescas Ocorr&ecirc;ncia - &eacute; utilizado como<span class=""ellipsis""> ... </span>",0868876081,1997
desenvolvimento rural,http://www.sapo.pt/culturais/governo/institutos/index.html,https://arquivo.pt/wayback/19971008223533/http://www.sapo.pt/culturais/governo/institutos/index.html,SAPO / Institutos," Minist&eacute;rio do Ambiente. Instituto de Estruturas Agr&aacute;rias e <em>Desenvolvimento</em> <em>Rural</em> Minist&eacute;rio da<span class=""ellipsis""> ... </span>",0876350133,1997
desenvolvimento rural,http://planeta.parlamento.pt/vii/comiss/adrp/index.html,https://arquivo.pt/wayback/19970207003528/http://planeta.parlamento.pt/vii/comiss/adrp/index.html,Comissão ADRP,"Comiss&atilde;o ADRP Comiss&atilde;o de Agricultura, <em>Desenvolvimento</em> <em>Rural</em> e Pescas Composi&ccedil;&atilde;o da Comiss&atilde;o Listagem Alfab&eacute;tica dos Deputados que Integram a Comiss&atilde;o Subcomiss&otilde;es [ Conhecer o Parlamento ] [ A Semana Parlamentar: Boletim ] [ Os Deputados ] [ As Reuni&otilde;es Plen&aacute;rias ] [ As Comiss&otilde;es Parlamentares<span class=""ellipsis""> ... </span>",0855275728,1997
desenvolvimento rural,http://planeta.parlamento.pt/vii/comiss/adrp/subcom/pescas/compo.html,https://arquivo.pt/wayback/19970207021720/http://planeta.parlamento.pt/vii/comiss/adrp/subcom/pescas/compo.html,Subcomissão Pescas,"Subcomiss&atilde;o Pescas Comiss&atilde;o de Agricultura, <em>Desenvolvimento</em> <em>Rural</em> e Pescas Subcomiss&atilde;o Permanente - Pescas Grupo Parlamentar N&uacute;mero de Lugares Grupo Parlamentar do Partido Socialista 3 Grupo Parlamentar do Partido Social Democrata 2 Grupo Parlamentar do Partido Popular 1 Grupo Parlamentar do<span class=""ellipsis""> ... </span>",0855281840,1997
desenvolvimento rural,http://www.ncc.up.pt/~alex/,https://arquivo.pt/wayback/19970524052800/http://www.ncc.up.pt/~alex/,ALEXANDRE SOUSA," Recursos Naturais - Probasto (Ag&ecirc;ncia de <em>Desenvolvimento</em> <em>Rural</em> das Terras de Basto) - Regionaliza&ccedil;&atilde;o<span class=""ellipsis""> ... </span>",0864451680,1997
desenvolvimento rural,http://www.isec.pt/ipc/esac/bea.html,https://arquivo.pt/wayback/19970802060033/http://www.isec.pt/ipc/esac/bea.html,Escola Superior Agrária de Coimbra - Engenharia do Ambiente," &nbsp; H/Semana T TP P <em>Desenvolvimento</em> <em>Rural</em> - 50 - Avalia&ccedil;&atilde;o de Impacte Ambiental - 60 - Sistemas Agro<span class=""ellipsis""> ... </span>",0870501633,1997
desenvolvimento rural,http://www.inia.pt/bonINIA.HTM,https://arquivo.pt/wayback/19971023182657/http://www.inia.pt/bonINIA.HTM,HistINIA.HTML,". Actualmente o INIA integrado no Minist&eacute;rio da Agricultura, do <em>Desenvolvimento</em> <em>Rural</em> e das Pescas<span class=""ellipsis""> ... </span>",0877631217,1997
desenvolvimento rural,http://www.guiao.pt/navigation/9002501/9002502/9002502.html,https://arquivo.pt/wayback/19970205160138/http://www.guiao.pt/navigation/9002501/9002502/9002502.html,GuiaNet: Navegação: Administração Central,"GuiaNet: Navega&ccedil;&atilde;o: Administra&ccedil;&atilde;o Central Administra&ccedil;&atilde;o Central Minist&eacute;rio da Administra&ccedil;&atilde;o Interna Minist&eacute;rio da Agricultura <em>Desenvolvimento</em> <em>Rural</em> e Pescas Minist&eacute;rio da Ci&ecirc;ncia e da Tecnologia Minist&eacute;rio da Cultura Minist&eacute;rio da Defesa Nacional Minist&eacute;rio da Economia Minist&eacute;rio da Educa&ccedil;&atilde;o<span class=""ellipsis""> ... </span>",0855158498,1997
desenvolvimento rural,http://students.fct.unl.pt/users/mmac/nacional.htm,https://arquivo.pt/wayback/19970722211707/http://students.fct.unl.pt/users/mmac/nacional.htm,Sylicon´s Site - Portuguese Sites," Instituto de Estruturas Agr&aacute;rias e <em>Desenvolvimento</em> <em>Rural</em> INAG- Instituto da &Aacute;gua ICN-Instituto de<span class=""ellipsis""> ... </span>",0869606227,1997
desenvolvimento rural,http://students.fct.unl.pt/licencia/ambient.htm,https://arquivo.pt/wayback/19970723073237/http://students.fct.unl.pt/licencia/ambient.htm,"Eng. Ambiente - NovaNet, Students FCT-UNL"," Administra&ccedil;&atilde;o do Territ&oacute;rio Minist&eacute;rio da Agricultura, <em>Desenvolvimento</em> <em>Rural</em> e Pescas Minist&eacute;rio da Economia<span class=""ellipsis""> ... </span>",0869643157,1997
desenvolvimento rural,http://www.obsambiente.pt/entrev.html,https://arquivo.pt/wayback/19970120095910/http://www.obsambiente.pt/entrev.html,15 ENTREVISTAS FUNDAMENTAIS SOBRE AMBIENTE,". Gomes da Silva Ministro da Agricultura e <em>Desenvolvimento</em> <em>Rural</em> Pedro Vieira Forum Ambiente entrevista Dr<span class=""ellipsis""> ... </span>",0853754350,1997
